4,7,7,14,1,0,4,1,0,5,0,2,"Onde è da sapere che se una pietra potesse cadere da questo nostro polo, ella caderebbe là oltre mare Occeano, a punto in su quel dosso mare dove se fosse uno uomo, la stella li sarebbe sempre in mezzo capo. E credo che da <i>Roma</i> a questo luogo, andando diritto per tramontana, sia spazio quasi di dumilia settecento miglia, o poco più meno.",Roma,Roma,https://dantesearch.dantenetwork.it/api.html?lemma=Roma,Conv. III v 9,45,Convivio,2,Roma
4,7,7,14,1,0,4,1,0,5,0,2,"Imaginando adunque, per meglio vedere, che in questo luogo ch' io dissi sia una cittade e abbia nome Maria, dico ancora che se altro polo, cioè meridionale, cadesse una pietra, ch' ella caderebbe in su quel dosso mare Occeano ch' è a punto in questa palla opposito a Maria. E credo che da <i>Roma</i> là dove caderebbe questa seconda pietra, diritto andando per mezzogiorno, sia spazio di settemilia cinquecento miglia, o poco più meno.",Roma,Roma,https://dantesearch.dantenetwork.it/api.html?lemma=Roma,Conv. III v 10,45,Convivio,3,Roma
4,7,7,14,1,0,4,1,0,5,0,2,"anche uno cerchio in su questa palla, che sia in ciascuna parte sua tanto lungi da Maria quanto da Lucia. Credo che questo cerchio secondo ch' io comprendo per le sentenze astrologi e per quella d' Alberto Magna libro Natura luoghi e in quello Propietadi elementi, e anco per la testimonianza di Lucano nono suo libro dividerebbe questa terra discoperta mare Occeano, là mezzo die, quasi per tutta l' estremità primo climate, dove sono intra l' altre genti li Garamanti, che stanno sempre quasi nudi; quali venne Catone popolo di <i>Roma</i>, la segnoria di Cesare fuggendo.",Roma,Roma,https://dantesearch.dantenetwork.it/api.html?lemma=Roma,Conv. III v 12,45,Convivio,4,Roma
4,7,7,14,1,0,4,1,0,5,0,2,"Dico adunque che anticamente in Italia, quasi principio constituzione di <i>Roma</i> che fu settecento cinquanta anni innanzi, o poco più meno, che 'l Salvatore venisse, secondo che scrive Paulo Orosio tempo quasi che Numma Pompilio, secondo re Romani, vivea uno filosofo nobilissimo che si chiamò Pittagora. E che ello fosse in quel tempo, pare che ne tocchi alcuna cosa Tito Livio prima parte suo volume incidentemente.",Roma,Roma,https://dantesearch.dantenetwork.it/api.html?lemma=Roma,Conv. III xi 3,45,Convivio,5,Roma
4,7,7,14,1,0,4,1,0,5,0,2,"E però che più dolce natura in segnoreggiando, e più forte in sostenendo, e più sottile in acquistando né fu né fia che quella gente latina —sì come per esperienza si può vedere— e massimamente di quello popolo santo quale l' alto sangue troiano era mischiato, cioè <i>Roma</i>, Dio quello elesse a quello officio.",Roma,Roma,https://dantesearch.dantenetwork.it/api.html?lemma=Roma,Conv. IV iv 10,45,Convivio,6,Roma
4,7,7,14,1,0,4,1,0,5,0,2,"E però che sua venuta lo mondo, non solamente lo cielo ma la terra, convenia essere in ottima disposizione; e la ottima disposizione terra sia quando ella è monarchia, cioè tutta ad uno principe, come detto è di sopra; ordinato fu per lo divino provedimento quello popolo e quella cittade che ciò dovea compiere, cioè la gloriosa <i>Roma</i>.",Roma,Roma,https://dantesearch.dantenetwork.it/api.html?lemma=Roma,Conv. IV v 4,45,Convivio,7,Roma
4,7,7,14,1,0,4,1,0,5,0,2,"E tutto questo fu in uno temporale, che David nacque e nacque <i>Roma</i>, cioè che Enea venne di Troia in Italia, che fu origine cittade romana, sì come testimoniano le scritture. Per che assai è manifesto la divina elezione romano imperio, per lo nascimento santa cittade, che fu contemporaneo radice progenie di Maria.",Roma,Roma,https://dantesearch.dantenetwork.it/api.html?lemma=Roma,Conv. IV v 6,45,Convivio,8,Roma
4,7,7,14,1,0,4,1,0,5,0,2,"E chi dirà che fosse sanza divina inspirazione, Fabrizio infinita quasi moltitudine d' oro rifiutare, per non volere abandonare sua patria? Curio, Sanniti tentato di corrompere, grandissima quantità d' oro per carità patria rifiutare, dicendo che li romani cittadini non l' oro, ma li posseditori oro possedere voleano? e Muzio la sua mano propia incendere, perché fallato avea lo colpo che per liberare <i>Roma</i> pensato avea?",Roma,Roma,https://dantesearch.dantenetwork.it/api.html?lemma=Roma,Conv. IV v 13,45,Convivio,9,Roma
4,7,7,14,1,0,4,1,0,5,0,2,"Chi dirà di Torquato, giudicatore suo figliuolo a morte per amore publico bene, sanza divino aiutorio ciò avere sofferto? e Bruto predetto similemente? Chi dirà Decii e Drusi, che puosero la loro vita per la patria? Chi dirà cattivato Regolo, da Cartagine mandato a <i>Roma</i> per commutare li presi Cartaginesi a sé e altri presi Romani, avere contra sé per amore di Roma, dopo la legazione ritratta, consigliato, solo da umana, e non da divina natura mosso?",Roma,Roma,https://dantesearch.dantenetwork.it/api.html?lemma=Roma,Conv. IV v 14,45,Convivio,10,Roma
4,7,7,14,1,0,4,1,0,5,0,2,"Chi dirà di Torquato, giudicatore suo figliuolo a morte per amore publico bene, sanza divino aiutorio ciò avere sofferto? e Bruto predetto similemente? Chi dirà Decii e Drusi, che puosero la loro vita per la patria? Chi dirà cattivato Regolo, da Cartagine mandato a Roma per commutare li presi Cartaginesi a sé e altri presi Romani, avere contra sé per amore di <i>Roma</i>, dopo la legazione ritratta, consigliato, solo da umana, e non da divina natura mosso?",Roma,Roma,https://dantesearch.dantenetwork.it/api.html?lemma=Roma,Conv. IV v 14,45,Convivio,11,Roma
4,7,7,14,1,0,4,1,0,5,0,2,"Chi dirà di Quinzio Cincinnato, fatto dittatore e tolto aratro, dopo lo tempo officio, spontaneamente quello rifiutando, arare essere ritornato? Chi dirà di Cammillo, bandeggiato e cacciato in essilio, essere venuto a liberare <i>Roma</i> contra li suoi nimici, e dopo la sua liberazione spontaneamente essere ritornato in essilio per non offendere la senatoria autoritade, sanza divina instigazione?",Roma,Roma,https://dantesearch.dantenetwork.it/api.html?lemma=Roma,Conv. IV v 15,45,Convivio,12,Roma
4,7,7,14,1,0,4,1,0,5,0,2,"E non puose Iddio le mani propie battaglia dove li Albani Romani principio per lo campo regno combattero, quando uno solo Romano mani ebbe la franchigia di <i>Roma</i>? Non puose Iddio le mani propie, quando li Franceschi, tutta Roma presa, prendeano di furto Campidoglio di notte, e solamente una voce d' una oca fé ciò sentire?",Roma,Roma,https://dantesearch.dantenetwork.it/api.html?lemma=Roma,Conv. IV v 18,45,Convivio,13,Roma
4,7,7,14,1,0,4,1,0,5,0,2,"E non puose Iddio le mani propie battaglia dove li Albani Romani principio per lo campo regno combattero, quando uno solo Romano mani ebbe la franchigia di Roma? Non puose Iddio le mani propie, quando li Franceschi, tutta <i>Roma</i> presa, prendeano di furto Campidoglio di notte, e solamente una voce d' una oca fé ciò sentire?",Roma,Roma,https://dantesearch.dantenetwork.it/api.html?lemma=Roma,Conv. IV v 18,45,Convivio,14,Roma
4,7,7,14,1,0,4,1,0,5,0,2,"Et dextri regiones sunt Apulia, sed non tota, <i>Roma</i>, Ducatus, Tuscia et Ianuensis Marchia; sinistri autem pars Apulie, Marchia Anconitana, Romandiola, Lombardia, Marchia Trivisiana cum Venetiis. Forum Iulii vero et Ystria non nisi leve Ytalie esse possunt; nec insule Tyreni maris, videlicet Sicilia et Sardinia, non nisi dextre Ytalie sunt, vel ad dextram Ytaliam sociande.",Roma,Roma,https://dantesearch.dantenetwork.it/api.html?lemma=Roma,De vulg. I x 5,45,De Vulgari Eloquentia,15,Roma
4,7,7,14,1,0,4,1,0,5,0,2,"Vere matrem viperea feritate dilaniare contendit, dum contra <i>Romam</i> cornua rebellionis exacuit, que ad ymaginem suam atque similitudinem fecit illam.",Romam,Roma,https://dantesearch.dantenetwork.it/api.html?lemma=Roma,Ep. VII 25,45,Epistole,16,Roma
4,7,7,14,1,0,4,1,0,5,0,2,"Nos quoque eundem Patrem et Filium, eundem Deum et hominem, nec non eandem Matrem et Virginem profitentes, propter quos et propter quorum salutem ter de caritate interrogatum et dictum est: Petre, pasce sacrosanctum ovile; <i>Romam</i> - cui, post tot triumphorum pompas, et verbo et opere Christus orbis confirmavit imperium, quam etiam ille Petrus, et Paulus gentium predicator, in apostolicam sedem aspergine proprii sanguinis consecravit -, cum Ieremia, non lugenda prevenientes sed post ipsa dolentes, viduam et desertam lugere compellimur.",Romam,Roma,https://dantesearch.dantenetwork.it/api.html?lemma=Roma,Ep. XI 4,45,Epistole,17,Roma
4,7,7,14,1,0,4,1,0,5,0,2,"Quod ut gloriosa longanimitas foveat et defendat, <i>Romam</i> urbem, nunc utroque lumine destitutam, nunc Annibali nedum alii miserandam, solam sedentem et viduam prout superius proclamatur, qualis est, pro modulo vestre ymaginis ante mentales oculos affigatis oportet.",Romam,Roma,https://dantesearch.dantenetwork.it/api.html?lemma=Roma,Ep. XI 22,45,Epistole,18,Roma
4,7,7,14,1,0,4,1,0,5,0,2,"Emendabitur quidem - quanquam non sit quin nota infamis Apostolicam Sedem usque ad ignem, cui celi qui nunc sunt et terra sunt reservati, deturpet -, si unanimes omnes qui huiusmodi exorbitationis fuistis auctores, pro Sponsa Christi, pro sede Sponse que <i>Roma</i> est, pro Ytalia nostra, et ut plenius dicam, pro tota civitate peregrinante in terris, viriliter propugnetis, ut de palestra iam cepti certaminis undique ab Occeani margine circumspecta, cum gloria offerentes, audire possitis: «Gloria in excelsis»; et ut Vasconum obprobrium qui tam dira cupidine conflagrantes Latinorum gloriam sibi usurpare contendunt, per secula cuncta futura sit posteris in exemplum.",Roma,Roma,https://dantesearch.dantenetwork.it/api.html?lemma=Roma,Ep. XI 27,45,Epistole,19,Roma
4,7,7,14,1,0,4,1,0,5,0,2,"corte di <i>Roma, </i> ad Orbivieto.","Roma,",Roma,https://dantesearch.dantenetwork.it/api.html?lemma=Roma,"Fiore 92, 11",45,Il Fiore,20,Roma
4,7,7,14,1,0,4,1,0,5,0,2,e vissi a <i>Roma</i> sotto 'l buono Augusto,Roma,Roma,https://dantesearch.dantenetwork.it/api.html?lemma=Roma,Inf. I 70,45,Commedia - Inferno,21,Roma
4,7,7,14,1,0,4,1,0,5,0,2,ch' e' fu de l' alma <i>Roma</i> e di suo impero,Roma,Roma,https://dantesearch.dantenetwork.it/api.html?lemma=Roma,Inf. II 20,45,Commedia - Inferno,22,Roma
4,7,7,14,1,0,4,1,0,5,0,2,e <i>Roma</i> guarda come suo speglio.,Roma,Roma,https://dantesearch.dantenetwork.it/api.html?lemma=Roma,Inf. XIV 105,45,Commedia - Inferno,23,Roma
4,7,7,14,1,0,4,1,0,5,0,2,"come la pina di San Pietro a <i>Roma</i>,",Roma,Roma,https://dantesearch.dantenetwork.it/api.html?lemma=Roma,Inf. XXXI 59,45,Commedia - Inferno,24,Roma
4,7,7,14,1,0,4,1,0,5,0,2,"Nunquid non preferendi leges propriis commodis memorabile nobis exemplar Camillus fuit qui, secundum Livium, dampnatus exilio, postquam patriam liberavit obsessam, spolia etiam romana <i>Rome</i> restituit, universo populo reclamante, ab urbe sancta discessit, nec ante reversus est quam sibi repatriandi licentia de auctoritate senatus allata est? Et hunc magnanimum Poeta commendat in sexto cum dicit: referentem signa Camillum.",Rome,Roma,https://dantesearch.dantenetwork.it/api.html?lemma=Roma,Mon. II v 12,45,Monarchia,25,Roma
4,7,7,14,1,0,4,1,0,5,0,2,"Que si ita se habent, non dubium est quin natura locum et gentem disposuerit in mundo ad universaliter principandum: aliter sibi defecisset, quod est inpossibile. Quis autem fuerit locus et que gens, per dicta superius et per dicenda inferius satis est manifestum quod fuerit <i>Roma</i>, et cives eius sive populus.",Roma,Roma,https://dantesearch.dantenetwork.it/api.html?lemma=Roma,Mon. II vi 8,45,Monarchia,26,Roma
4,7,7,14,1,0,4,1,0,5,0,2,"Sed quod <i>Roma</i> palmam tanti bravii sit adepta, multis comprobatur testimoniis. Ait enim Poeta noster in primo: Certe hinc Romanos olim volventibus annis hinc fore ductores, revocato a sanguine Teucri, qui mare, qui terras omni ditione tenerent.",Roma,Roma,https://dantesearch.dantenetwork.it/api.html?lemma=Roma,Mon. II viii 11,45,Monarchia,27,Roma
4,7,7,14,1,0,4,1,0,5,0,2,"Postquam vero Ytalorum litigia sedata fuerunt, et cum Grecis Penis nondum pro divino iudicio certatum esset, ad Imperium intendentibus illis et illis, Fabritio pro Romanis, Pirro pro Grecis, de imperii gloria in militie multitudine decertantibus, <i>Roma</i> obtinuit; Scipione vero pro Ytalis, Annibale pro Affricanis in forma duelli bellum gerentibus, Ytalis Affricani succubuerunt, sicut Livius et omnes romane rei scriptores testificari conantur.",Roma,Roma,https://dantesearch.dantenetwork.it/api.html?lemma=Roma,Mon. II ix 18,45,Monarchia,28,Roma
4,7,7,14,1,0,4,1,0,5,0,2,"Dicunt adhuc quidam quod Constantinus imperator, mundatus a lepra intercessione Silvestri tunc summi Pontificis, Imperii sedem, scilicet <i>Romam</i>, donavit Ecclesie cum multis aliis Imperii dignitatibus.",Romam,Roma,https://dantesearch.dantenetwork.it/api.html?lemma=Roma,Mon. III x 1,45,Monarchia,29,Roma
4,7,7,14,1,0,4,1,0,5,0,2,Cesare per voler di <i>Roma</i> il tolle.,Roma,Roma,https://dantesearch.dantenetwork.it/api.html?lemma=Roma,Par. VI 57,45,Commedia - Paradiso,30,Roma
4,7,7,14,1,0,4,1,0,5,0,2,di <i>Roma</i> che son state cimitero,Roma,Roma,https://dantesearch.dantenetwork.it/api.html?lemma=Roma,Par. IX 140,45,Commedia - Paradiso,31,Roma
4,7,7,14,1,0,4,1,0,5,0,2,"d' i Troiani, di Fiesole e di <i>Roma</i>.",Roma,Roma,https://dantesearch.dantenetwork.it/api.html?lemma=Roma,Par. XV 126,45,Commedia - Paradiso,32,Roma
4,7,7,14,1,0,4,1,0,5,0,2,"voi che prima a <i>Roma</i> s' offerie,",Roma,Roma,https://dantesearch.dantenetwork.it/api.html?lemma=Roma,Par. XVI 10,45,Commedia - Paradiso,33,Roma
4,7,7,14,1,0,4,1,0,5,0,2,"che mise <i>Roma</i> buon filo,",Roma,Roma,https://dantesearch.dantenetwork.it/api.html?lemma=Roma,Par. XXIV 63,45,Commedia - Paradiso,34,Roma
4,7,7,14,1,0,4,1,0,5,0,2,"difese a <i>Roma</i> la gloria mondo,",Roma,Roma,https://dantesearch.dantenetwork.it/api.html?lemma=Roma,Par. XXVII 62,45,Commedia - Paradiso,35,Roma
4,7,7,14,1,0,4,1,0,5,0,2,"veggendo <i>Roma</i> e l' ardua sua opra,",Roma,Roma,https://dantesearch.dantenetwork.it/api.html?lemma=Roma,Par. XXXI 34,45,Commedia - Paradiso,36,Roma
4,7,7,14,1,0,4,1,0,5,0,2,Vieni a veder la tua <i>Roma</i> che piagne,Roma,Roma,https://dantesearch.dantenetwork.it/api.html?lemma=Roma,Purg. VI 112,45,Commedia - Purgatorio,37,Roma
4,7,7,14,1,0,4,1,0,5,0,2,"Soleva <i>Roma</i>, che 'l buon mondo feo,",Roma,Roma,https://dantesearch.dantenetwork.it/api.html?lemma=Roma,Purg. XVI 106,45,Commedia - Purgatorio,38,Roma
4,7,7,14,1,0,4,1,0,5,0,2,"Dì oggimai che la Chiesa di <i>Roma</i>,",Roma,Roma,https://dantesearch.dantenetwork.it/api.html?lemma=Roma,Purg. XVI 127,45,Commedia - Purgatorio,39,Roma
4,7,7,14,1,0,4,1,0,5,0,2,che 'l sole infiamma allor che quel da <i>Roma</i>,Roma,Roma,https://dantesearch.dantenetwork.it/api.html?lemma=Roma,Purg. XVIII 80,45,Commedia - Purgatorio,40,Roma
4,7,7,14,1,0,4,1,0,5,0,2,"che, tolosano, a sé mi trasse <i>Roma</i>,",Roma,Roma,https://dantesearch.dantenetwork.it/api.html?lemma=Roma,Purg. XXI 89,45,Commedia - Purgatorio,41,Roma
4,7,7,14,1,0,4,1,0,5,0,2,Non <i>Roma</i> di carro così bello,Roma,Roma,https://dantesearch.dantenetwork.it/api.html?lemma=Roma,Purg. XXIX 115,45,Commedia - Purgatorio,42,Roma
4,7,7,14,1,0,4,1,0,5,0,2,di quella <i>Roma</i> onde Cristo è romano.,Roma,Roma,https://dantesearch.dantenetwork.it/api.html?lemma=Roma,Purg. XXXII 102,45,Commedia - Purgatorio,43,Roma
4,7,7,14,1,0,4,1,0,5,0,2,"Potrebbe qui dubitare persona degna da onne dubitazione, e dubitare potrebbe di ciò, che io dico d' Amore come se fosse una cosa per sé, e non solamente sustanzia intelligente, ma sì come fosse sustanzia corporale: la quale cosa, secondo la veritate, è falsa; ché Amore non è per sé sì come sustanzia, ma è uno accidente in sustanzia. ¶ 2. E che io dica di lui come se fosse corpo, ancora sì come se fosse uomo, appare per tre cose che dico di lui. Dico che lo vidi venire; onde, con ciò sia cosa che venire dica moto locale, e localmente mobile per sé, secondo lo Filosofo, sia solamente corpo, appare che io ponga Amore essere corpo. Dico anche di lui che ridea, e anche che parlava; le quali cose paiono essere proprie de l' uomo, e spezialmente essere risibile; e però appare ch' io ponga lui essere uomo. ¶ 3. A cotale cosa dichiarare, secondo che è buono a presente, prima è da intendere che anticamente non erano dicitori d' amore in lingua volgare, anzi erano dicitori d' amore certi poete in lingua latina; tra noi dico, avvegna forse che tra altra gente addivenisse, e addivegna ancora, sì come in Grecia, non volgari ma litterati poete queste cose trattavano. ¶ 4. E non è molto numero d' anni passati, che appariro prima questi poete volgari; ché dire per rima in volgare tanto è quanto dire per versi in latino, secondo alcuna proporzione. E segno che sia picciolo tempo, è che se volemo cercare in lingua d' e in quella di noi non troviamo cose dette anzi lo presente tempo per cento e cinquanta anni. ¶ 5. E la cagione per che alquanti grossi ebbero fama di sapere dire, è che quasi fuoro li primi che dissero in lingua di sì. ¶ 6. E lo primo che cominciò a dire sì come poeta volgare, si mosse però che volle fare intendere le sue parole a donna, a la quale era malagevole d' intendere li versi latini. E questo è contra coloro che rimano sopra altra matera che amorosa, con ciò sia cosa che cotale modo di parlare fosse principio trovato per dire d' amore. ¶ 7. Onde, con ciò sia cosa che a li poete sia conceduta maggiore licenza di parlare che a li prosaici dittatori, e questi dicitori per rima non siano altro che poete volgari, degno e ragionevole è che a loro sia maggiore licenzia largita di parlare che a li altri parlatori volgari: onde, se alcuna figura o colore rettorico è conceduto a li poete, conceduto è a li rimatori. ¶ 8. Dunque, se noi vedemo che li poete hanno parlato a le cose inanimate, sì come se avessero senso e ragione, e parlare insieme; e non solamente cose vere, ma cose non vere, cioè che detto hanno, di cose le quali non sono, che parlano, e detto che molti accidenti parlano, sì come se fossero sustanzie e uomini; degno è lo dicitore per rima di fare lo somigliante, ma non sanza ragione alcuna, ma con ragione la quale poi sia possibile d' aprire per prosa. ¶ 9. Che li poete abbiano così parlato come detto è, appare per Virgilio; lo quale dice che Iuno, cioè una dea nemica de li Troiani, parloe ad Eolo, segnore de li venti, quivi primo de lo Eneida: e che questo segnore le rispuose, quivi: Per questo medesimo poeta parla la cosa che non è animata a le cose animate, terzo de lo Eneida, quivi: Per Lucano parla la cosa animata a la cosa inanimata, quivi: Per Orazio parla l' uomo a la scienzia medesima sì come ad altra persona; e non solamente sono parole d' Orazio, ma quasi recitando lo modo buono Omero, quivi ne la sua Poetria: Per Ovidio parla Amore, sì come se fosse persona umana, ne lo principio de lo libro c' ha nome Libro di Remedio d'Amore, quivi:. E per questo puote essere manifesto a chi dubita in alcuna parte di questo mio libello. ¶ 10. E acciò che non ne pigli alcuna baldanza persona grossa, dico che né li poete parlavano così sanza ragione, né quelli che rimano deono parlare così non avendo alcuno ragionamento in loro di quello che dicono; però che grande vergogna sarebbe a colui che rimasse cose sotto vesta di figura o di colore rettorico, e poscia, domandato, non sapesse denudare le sue parole da cotale vesta, in guisa che avessero verace intendimento. E questo mio primo amico e io ne sapemo bene di quelli che così rimano stoltamente.",Roma,Roma,https://dantesearch.dantenetwork.it/api.html?lemma=Roma,VN XXV,45,Vita Nuova,44,Roma
4,7,7,14,1,0,4,1,0,5,0,2,"Dopo questa tribulazione avvenne, in quello tempo che molta gente va per vedere quella imagine benedetta la quale Iesu Cristo lasciò a noi per essemplo de la sua bellissima figura, la quale vede la mia donna gloriosamente, che alquanti peregrini passavano per una via la quale è quasi mezzo de la cittade ove nacque e vivette e morio la gentilissima donna. ¶ 2. Li quali peregrini andavano, secondo che mi parve, molto pensosi; ond' io, pensando a loro, dissi fra me medesimo: «Questi peregrini mi paiono di lontana parte, e non credo che anche udissero parlare di questa donna, e non ne sanno neente; anzi li loro penseri sono d' altre cose che di queste qui, ché forse pensano de li loro amici lontani, li quali noi non conoscemo». ¶ 3. Poi dicea fra me medesimo: «Io so che s' elli fossero di propinquo paese, in alcuna vista parrebbero turbati passando per lo mezzo de la dolorosa cittade». ¶ 4. Poi dicea fra me medesimo: «Se io li potesse tenere alquanto, io li pur farei piangere anzi ch' elli uscissero di questa cittade, però che io direi parole le quali farebbero piangere chiunque le intendesse». ¶ 5. Onde, passati costoro da la mia veduta, propuosi di fare uno sonetto, ne lo quale io manifestasse ciò che io avea detto fra me medesimo; e acciò che che più paresse pietoso, propuosi di dire come se io avesse parlato a loro; e dissi questo sonetto, lo quale comincia: E dissi ""peregrini"" secondo la larga significazione vocabulo; ché peregrini si possono intendere in due modi, in uno largo e in uno stretto: in largo, in quanto è peregrino chiunque è fuori de la sua patria; in modo stretto non s' intende peregrino se non chi va verso la casa di sa' Iacopo o riede. ¶ 7. E però è da sapere che in tre modi si chiamano propriamente le genti che vanno servigio de l' Altissimo: palmieri in quanto vanno oltremare, là onde molte volte recano la palma; peregrini in quanto vanno a la casa di Galizia, però che la sepultura di sa' Iacopo fue più lontana de la sua patria che d' alcuno altro apostolo; romei in quanto vanno a <i>Roma</i>, là ove questi cu' io chiamo peregrini andavano.",Roma,Roma,https://dantesearch.dantenetwork.it/api.html?lemma=Roma,VN XL 7,45,Vita Nuova,45,Roma
0,0,0,0,2,0,0,0,0,0,0,0,"Et dextri regiones sunt Apulia, sed non tota, Roma, Ducatus, Tuscia et Ianuensis Marchia; sinistri autem pars Apulie, Marchia Anconitana, <i>Romandiola</i>, Lombardia, Marchia Trivisiana cum Venetiis. Forum Iulii vero et Ystria non nisi leve Ytalie esse possunt; nec insule Tyreni maris, videlicet Sicilia et Sardinia, non nisi dextre Ytalie sunt, vel ad dextram Ytaliam sociande.",Romandiola,Romandiola,https://dantesearch.dantenetwork.it/api.html?lemma=Romandiola,De vulg. I x 5,2,De Vulgari Eloquentia,1,Romandiola
0,0,0,0,2,0,0,0,0,0,0,0,"<i>Romandiolam</i> igitur ingredientes, dicimus nos duo in Latio invenisse vulgaria quibusdam convenientiis contrariis alternata. Quorum unum in tantum muliebre videtur propter vocabulorum et prolationis mollitiem quod virum, etiam si viriliter sonet, feminam tamen facit esse credendum.",Romandiolam,Romandiola,https://dantesearch.dantenetwork.it/api.html?lemma=Romandiola,De vulg. I xiv 2,2,De Vulgari Eloquentia,2,Romandiola
0,0,0,0,0,1,0,0,0,0,0,0,litora dextra Pado ratus a <i>Rubicone</i> sinistra,Rubicone,Rubico,https://dantesearch.dantenetwork.it/api.html?lemma=Rubico,Eg. IV 67,1,Egloge,1,Rubico
0,0,0,0,0,0,1,0,0,0,0,0,"breviter colligam, quas tulit calamitates illa civitas gloriosa in fide pro libertate <i>Saguntum</i>, ignominiose vos eas in perfidia pro servitute subire necesse est.",Saguntum,Saguntum,https://dantesearch.dantenetwork.it/api.html?lemma=Saguntum,Ep. VI 18,1,Epistole,1,Saguntum
0,0,0,0,1,0,0,0,0,0,0,0,"Et dextri regiones sunt Apulia, sed non tota, Roma, Ducatus, Tuscia et Ianuensis Marchia; sinistri autem pars Apulie, Marchia Anconitana, Romandiola, Lombardia, Marchia Trivisiana cum Venetiis. Forum Iulii vero et Ystria non nisi leve Ytalie esse possunt; nec insule Tyreni maris, videlicet Sicilia et <i>Sardinia</i>, non nisi dextre Ytalie sunt, vel ad dextram Ytaliam sociande.",Sardinia,Sardinia,https://dantesearch.dantenetwork.it/api.html?lemma=Sardinia,De vulg. I x 5,1,De Vulgari Eloquentia,1,Sardinia
0,0,0,0,1,2,4,0,0,0,0,0,"Nos autem, cui mundus est patria velut piscibus equor, quanquam <i>Sarnum</i> biberimus ante dentes et Florentiam adeo diligamus ut, quia dileximus, exilium patiamur iniuste, rationi magis quam sensui spatulas nostri iudicii podiamus. Et quamvis ad voluptatem nostram sive nostre sensualitatis quietem in terris amenior locus quam Florentia non existat, revolventes et poetarum et aliorum scriptorum volumina quibus mundus universaliter et membratim describitur, in nobis situationes varias mundi locorum et eorum habitudinem ad utrunque polum et circulum equatorem, multas esse perpendimus censemus et magis nobiles et magis delitiosas et regiones et urbes quam Tusciam et Florentiam, unde sumus oriundus et civis, et plerasque nationes et gentes delectabiliori atque utiliori sermone uti quam Latinos.",Sarnum,Sarnus,https://dantesearch.dantenetwork.it/api.html?lemma=Sarnus,De vulg. I vi 3,7,De Vulgari Eloquentia,1,Sarnus
0,0,0,0,1,2,4,0,0,0,0,0,fronde sub inserta solitum flavescere <i>Sarno? </i>».,Sarno?,Sarnus,https://dantesearch.dantenetwork.it/api.html?lemma=Sarnus,Eg. II 44,7,Egloge,2,Sarnus
0,0,0,0,1,2,4,0,0,0,0,0,et merito indignans singultes pascua <i>Sarni</i>,Sarni,Sarnus,https://dantesearch.dantenetwork.it/api.html?lemma=Sarnus,Eg. III 37,7,Egloge,3,Sarnus
0,0,0,0,1,2,4,0,0,0,0,0,"Igitur michi a limine suspirate postea curie separato, in qua, velud sepe sub admiratione vidistis, fas fuit sequi libertatis officia, cum primum pedes iuxta <i>Sarni</i> fluenta securus et incautus defigerem, subito heu! mulier, ceu fulgur descendens, apparuit, nescio quomodo, meis auspitiis undique moribus et forma conformis.",Sarni,Sarnus,https://dantesearch.dantenetwork.it/api.html?lemma=Sarnus,Ep. IV 3,7,Epistole,4,Sarnus
0,0,0,0,1,2,4,0,0,0,0,0,"Scriptum pridie Kalendas Apriles in finibus Tuscie sub fontem <i>Sarni</i>, faustissimi cursus Henrici Cesaris ad Ytaliam anno primo.",Sarni,Sarnus,https://dantesearch.dantenetwork.it/api.html?lemma=Sarnus,Ep. VI 27,7,Epistole,5,Sarnus
