0,0,0,0,2,0,0,0,0,0,0,0,"Itaque si preponentes eos in vulgari sermone sola municipalia Latinorum vulgaria comparando considerant, allubescentes concordamus cum illis; si vero simpliciter vulgare bononiense preferendum existimant, dissentientes discordamus ab eis. Non etenim est quod aulicum et illustre vocamus: quoniam, si fuisset, maximus Guido Guinizelli, Guido Ghisilerius, Fabrutius et Honestus et alii poetantes <i>Bononie</i> nunquam a proprio divertissent: qui doctores fuerunt illustres et vulgarium discretione repleti. Maximus Guido: Madonna, 'l fino amore ch'io vi porto; Guido Ghisilerius: Donna, lo fermo core; Fabrutius: Lo meo lontano gire; Honestus: Più non attendo il tuo soccorso, amore. Que quidem verba prorsus a mediastinis Bononie sunt diversa.",Bononie,Bononia,https://dantesearch.dantenetwork.it/api.html?lemma=Bononia,De vulg. I xv 6,2,De Vulgari Eloquentia,1,Bononia
0,0,0,0,2,0,0,0,0,0,0,0,"Itaque si preponentes eos in vulgari sermone sola municipalia Latinorum vulgaria comparando considerant, allubescentes concordamus cum illis; si vero simpliciter vulgare bononiense preferendum existimant, dissentientes discordamus ab eis. Non etenim est quod aulicum et illustre vocamus: quoniam, si fuisset, maximus Guido Guinizelli, Guido Ghisilerius, Fabrutius et Honestus et alii poetantes Bononie nunquam a proprio divertissent: qui doctores fuerunt illustres et vulgarium discretione repleti. Maximus Guido: Madonna, 'l fino amore ch'io vi porto; Guido Ghisilerius: Donna, lo fermo core; Fabrutius: Lo meo lontano gire; Honestus: Più non attendo il tuo soccorso, amore. Que quidem verba prorsus a mediastinis <i>Bononie</i> sunt diversa.",Bononie,Bononia,https://dantesearch.dantenetwork.it/api.html?lemma=Bononia,De vulg. I xv 6,2,De Vulgari Eloquentia,2,Bononia
0,0,0,0,1,0,1,0,0,0,0,0,"Dicimus ergo quod forte non male opinantur qui Bononienses asserunt pulcriori locutione loquentes, cum ab Ymolensibus, Ferrarensibus et Mutinensibus circunstantibus aliquid proprio vulgari asciscunt, sicut facere quoslibet a finitimis suis conicimus, ut Sordellus de Mantua sua ostendit, Cremone, <i>Brixie</i> atque Verone confini: qui, tantus eloquentie vir existens, non solum in poetando sed quomodocunque loquendo patrium vulgare deseruit.",Brixie,Brixia,https://dantesearch.dantenetwork.it/api.html?lemma=Brixia,De vulg. I xv 2,2,De Vulgari Eloquentia,1,Brixia
0,0,0,0,1,0,1,0,0,0,0,0,"Quid, preses unice mundi, peregisse preconicis cum cervicem Cremone deflexeris contumacis? nonne tunc vel <i>Brixie</i> vel Papie rabies inopina turgescet? Ymo, que cum etiam flagellata resederit, mox alia Vercellis vel Pergami vel alibi returgebit, donec huius scatescentie causa radicalis tollatur, et radice tanti erroris avulsa, cum trunco rami pungitivi arescant.",Brixie,Brixia,https://dantesearch.dantenetwork.it/api.html?lemma=Brixia,Ep. VII 22,2,Epistole,2,Brixia
0,0,0,0,0,0,1,0,0,0,0,0,"Tu quoque, Transtiberine, sectator factionis alterius, ut ira defuncti Antistitis in te velut ramus insitionis in trunco non suo frondesceret, quam in triumphatam <i>Carthaginem</i> nondum exueras, illustrium Scipionum patrie potuisti hunc animum sine ulla tui iudicii contradictione preferre.",Carthaginem,Carthago,https://dantesearch.dantenetwork.it/api.html?lemma=Carthago,Ep. XI 26,1,Epistole,1,Carthago
0,0,0,1,0,0,0,0,0,1,0,0,"E cui non è ancora cuore Alessandro per li suoi reali benefici? Cui non è ancora lo buono re di <i>Castella</i> o il Saladino o il buono Marchese di Monferrato o il buono Conte di Tolosa o Beltramo Bornio o Galasso di Montefeltro? Quando loro messioni si fa menzione, certo non solamente quelli che ciò farebbero volentieri, ma quelli che prima morire vorrebbero che ciò fare, amore hanno memoria di costoro.",Castella,Castella,https://dantesearch.dantenetwork.it/api.html?lemma=Castella,Conv. IV xi 14,2,Convivio,1,Castella
0,0,0,1,0,0,0,0,0,1,0,0,"Sed Monarcha non habet quod possit optare: sua iurisdictio terminatur Occeano solum: quod non contingit principibus aliis, quorum principatus ad alios terminantur, ut puta regis <i>Castelle</i> ad illum qui regis Aragonum. Ex quo sequitur quod Monarcha sincerissimum inter mortales iustitie possit esse subiectum.",Castelle,Castella,https://dantesearch.dantenetwork.it/api.html?lemma=Castella,Mon. I xi 12,2,Monarchia,2,Castella
0,0,0,0,0,1,1,0,0,0,0,0,"<i>Caucason</i> Hyrcane maculent quod sanguine tigres,",Caucason,Caucasus,https://dantesearch.dantenetwork.it/api.html?lemma=Caucasus,Eg. IV 22,2,Egloge,1,Caucasus
0,0,0,0,0,1,1,0,0,0,0,0,"An septi vallo ridiculo cuiquam defensioni confiditis? O male concordes! o mira cupidine obcecati! Quid vallo sepsisse, quid propugnaculis et pinnis urbem armasse iuvabit, cum advolaverit aquila in auro terribilis, que nunc Pirenen, nunc <i>Caucason</i>, nunc Athlanta supervolans, militie celi magis confortata sufflamine, vasta maria quondam transvolando despexit? quid, cum adfore stupescetis, miserrimi hominum, delirantis Hesperie domitorem?",Caucason,Caucasus,https://dantesearch.dantenetwork.it/api.html?lemma=Caucasus,Ep. VI 12,2,Epistole,2,Caucasus
0,0,0,0,1,0,0,0,0,0,0,0,"De Perusio, Urbe Veteri, Viterbio, nec non de Civitate <i>Castellana</i>, propter affinitatem quam habent cum Romanis et Spoletanis, nichil tractare intendimus.",Castellana,Castellanus,https://dantesearch.dantenetwork.it/api.html?lemma=Castellanus,De vulg. I xiii 3,1,De Vulgari Eloquentia,1,Castellanus
0,0,0,0,0,0,0,0,0,1,0,0,"Adhuc dicunt quod Adrianus papa Carolum Magnum sibi et Ecclesie advocavit ob iniuriam Longobardorum, tempore Desiderii regis eorum; et quod Carolus ab eo recepit Imperii dignitatem non obstante quod Michael imperabat apud <i>Constantinopolim</i>.",Constantinopolim,Constantinopolis,https://dantesearch.dantenetwork.it/api.html?lemma=Constantinopolis,Mon. III xi 1,1,Monarchia,1,Constantinopolis
0,0,0,0,2,0,1,0,0,0,0,0,"Dicimus ergo quod forte non male opinantur qui Bononienses asserunt pulcriori locutione loquentes, cum ab Ymolensibus, Ferrarensibus et Mutinensibus circunstantibus aliquid proprio vulgari asciscunt, sicut facere quoslibet a finitimis suis conicimus, ut Sordellus de Mantua sua ostendit, <i>Cremone</i>, Brixie atque Verone confini: qui, tantus eloquentie vir existens, non solum in poetando sed quomodocunque loquendo patrium vulgare deseruit.",Cremone,Cremona,https://dantesearch.dantenetwork.it/api.html?lemma=Cremona,De vulg. I xv 2,3,De Vulgari Eloquentia,1,Cremona
0,0,0,0,2,0,1,0,0,0,0,0,"Hoc autem vulgare quod illustre, cardinale, aulicum et curiale ostensum est, dicimus esse illud quod vulgare latium appellatur. Nam sicut quoddam vulgare est invenire quod proprium est <i>Cremone</i>, sic quoddam est invenire quod proprium est Lombardie; et sicut est invenire aliquod quod sit proprium Lombardie, est invenire aliquod quod sit totius sinistre Ytalie proprium; et sicut omnia hec est invenire, sic et illud quod totius Ytalie est. Et sicut illud cremonense ac illud lombardum et tertium semilatium dicitur, sic istud, quod totius Ytalie est, latium vulgare vocatur. Hoc enim usi sunt doctores illustres qui lingua vulgari poetati sunt in Ytalia, ut Siculi, Apuli, Tusci, Romandioli, Lombardi et utriusque Marchie viri.",Cremone,Cremona,https://dantesearch.dantenetwork.it/api.html?lemma=Cremona,De vulg. I xix 1,3,De Vulgari Eloquentia,2,Cremona
0,0,0,0,2,0,1,0,0,0,0,0,"Quid, preses unice mundi, peregisse preconicis cum cervicem <i>Cremone</i> deflexeris contumacis? nonne tunc vel Brixie vel Papie rabies inopina turgescet? Ymo, que cum etiam flagellata resederit, mox alia Vercellis vel Pergami vel alibi returgebit, donec huius scatescentie causa radicalis tollatur, et radice tanti erroris avulsa, cum trunco rami pungitivi arescant.",Cremone,Cremona,https://dantesearch.dantenetwork.it/api.html?lemma=Cremona,Ep. VII 22,3,Epistole,3,Cremona
0,0,0,0,1,0,0,0,0,0,0,0,"Ab uno postea ydiomate in vindice confusione recepto diversa vulgaria traxerunt originem, sicut inferius ostendemus. Nam totum quod ab hostiis <i>Danubii</i> sive Meotidis paludibus usque ad fines occidentales Anglie Ytalorum finibus et Oceano limitatur, solum unum obtinuit ydioma, licet postea per Sclavones, Ungaros, Teutonicos, Saxones, Anglicos et alias nationes quamplures fuerit per diversa vulgaria dirivatum, hoc solo fere omnibus in signum eiusdem principii remanente, quod quasi predicti omnes affirmando respondent.",Danubii,Danubius,https://dantesearch.dantenetwork.it/api.html?lemma=Danubius,De vulg. I viii 3,1,De Vulgari Eloquentia,1,Danubius
0,0,0,0,0,1,1,0,0,0,0,0,Si tamen <i>Eridani</i> michi spem mediamne dedisti,Eridani,Eridanus,https://dantesearch.dantenetwork.it/api.html?lemma=Eridanus,Eg. I 47,2,Egloge,1,Eridanus
0,0,0,0,0,1,1,0,0,0,0,0,"Sed quid tam sera moretur segnities admiramur, quando iamdudum in valle victor <i>Eridani</i> non secus Tusciam derelinquis, pretermittis et negligis, quam si iura tutanda Imperii circumscribi Ligurum finibus arbitreris; non prorsus, ut suspicamur, advertens, quoniam Romanorum gloriosa potestas nec metis Ytalie nec tricornis Europe margine coarctatur.",Eridani,Eridanus,https://dantesearch.dantenetwork.it/api.html?lemma=Eridanus,Ep. VII 11,2,Epistole,2,Eridanus
0,0,0,0,0,1,0,0,0,0,0,0,arida Ciclopum placeant quod saxa sub <i>Ethna</i>».,Ethna,Ethna,https://dantesearch.dantenetwork.it/api.html?lemma=Ethna,Eg. IV 27,1,Egloge,1,Ethna
0,3,1,0,7,0,1,0,1,5,0,0,"Ex precedenter memorata confusione linguarum non leviter opinamur per universa mundi climata plagas incolendas et angulos tunc primum homines fuisse dispersos. Et cum radix humane propaginis principalis in oris orientalibus sit plantata, nec non ab inde ad utrunque latus per diffusos multipliciter palmites nostra sit extensa propago, ad fines occidentales protracta, forte primitus tunc vel totius <i>Europe</i> flumina, vel saltim quedam, rationalia guctura potaverunt.",Europe,Europa,https://dantesearch.dantenetwork.it/api.html?lemma=Europa,De vulg. I viii 1,18,De Vulgari Eloquentia,1,Europa
0,3,1,0,7,0,1,0,1,5,0,0,"Sed sive advene tunc primitus advenissent, sive ad <i>Europam</i> indigene repedassent, ydioma tripharium homines actulerunt; et afferentium hoc alii meridionalem, alii septentrionalem regionem in Europa sibi sortiti sunt; et tertii, quos nunc Grecos vocamus, partim Europe, partim Asye occuparunt.",Europam,Europa,https://dantesearch.dantenetwork.it/api.html?lemma=Europa,De vulg. I viii 2,18,De Vulgari Eloquentia,2,Europa
0,3,1,0,7,0,1,0,1,5,0,0,"Sed sive advene tunc primitus advenissent, sive ad Europam indigene repedassent, ydioma tripharium homines actulerunt; et afferentium hoc alii meridionalem, alii septentrionalem regionem in <i>Europa</i> sibi sortiti sunt; et tertii, quos nunc Grecos vocamus, partim Europe, partim Asye occuparunt.",Europa,Europa,https://dantesearch.dantenetwork.it/api.html?lemma=Europa,De vulg. I viii 2,18,De Vulgari Eloquentia,3,Europa
0,3,1,0,7,0,1,0,1,5,0,0,"Sed sive advene tunc primitus advenissent, sive ad Europam indigene repedassent, ydioma tripharium homines actulerunt; et afferentium hoc alii meridionalem, alii septentrionalem regionem in Europa sibi sortiti sunt; et tertii, quos nunc Grecos vocamus, partim <i>Europe</i>, partim Asye occuparunt.",Europe,Europa,https://dantesearch.dantenetwork.it/api.html?lemma=Europa,De vulg. I viii 2,18,De Vulgari Eloquentia,4,Europa
0,3,1,0,7,0,1,0,1,5,0,0,"Ab isto incipiens ydiomate, videlicet a finibus Ungarorum versus orientem, aliud occupavit totum quod ab inde vocatur <i>Europa</i>, nec non ulterius est protractum.",Europa,Europa,https://dantesearch.dantenetwork.it/api.html?lemma=Europa,De vulg. I viii 4,18,De Vulgari Eloquentia,5,Europa
0,3,1,0,7,0,1,0,1,5,0,0,"Totum vero quod in <i>Europa</i> restat ab istis, tertium tenuit ydioma, licet nunc tripharium videatur: nam alii alii alii affirmando locuntur, ut puta Yspani, Franci et Latini. Signum autem quod ab uno ydiomate istarum trium gentium progrediantur vulgaria, in promptu est, quia multa per eadem vocabula nominare videntur, ut “Deum”, “celum”, “amorem”, “mare”, “terram”, “est”, “vivit”, “moritur”, “amat”, alia fere omnia.",Europa,Europa,https://dantesearch.dantenetwork.it/api.html?lemma=Europa,De vulg. I viii 5,18,De Vulgari Eloquentia,6,Europa
0,3,1,0,7,0,1,0,1,5,0,0,"Istorum vero proferentes meridionalis <i>Europe</i> tenent partem occidentalem, a Ianuensium finibus incipientes. Qui autem dicunt a predictis finibus orientalem tenent, videlicet usque ad promuntorium illud Ytalie qua sinus Adriatici maris incipit, et Siciliam. Sed loquentes quodam modo septentrionales sunt respectu istorum: nam ab oriente Alamannos habent et ab occidente et septentrione anglico mari vallati sunt et montibus Aragonie terminati; a meridie quoque Provincialibus et Apenini devexione clauduntur.",Europe,Europa,https://dantesearch.dantenetwork.it/api.html?lemma=Europa,De vulg. I viii 6,18,De Vulgari Eloquentia,7,Europa
0,3,1,0,7,0,1,0,1,5,0,0,"Sed quid tam sera moretur segnities admiramur, quando iamdudum in valle victor Eridani non secus Tusciam derelinquis, pretermittis et negligis, quam si iura tutanda Imperii circumscribi Ligurum finibus arbitreris; non prorsus, ut suspicamur, advertens, quoniam Romanorum gloriosa potestas nec metis Ytalie nec tricornis <i>Europe</i> margine coarctatur.",Europe,Europa,https://dantesearch.dantenetwork.it/api.html?lemma=Europa,Ep. VII 11,18,Epistole,8,Europa
0,3,1,0,7,0,1,0,1,5,0,0,"<i>Europa</i> vero avo antiquissimo, scilicet Dardano: Affrica quoque avia vetustissima, Electra scilicet, nata magni nominis regis Athlantis; ut de ambobus testimonium reddit Poeta noster in octavo, ubi Eneas ad Evandrum sic ait: Dardanus yliace primus pater urbis et auctor, Electra, ut Grai perhibent, Athlantide cretus, advehitur Teucros: Electram maximus Athlas edidit, ethereos humero qui sustinet orbes.",Europa,Europa,https://dantesearch.dantenetwork.it/api.html?lemma=Europa,Mon. II iii 11,18,Monarchia,9,Europa
0,3,1,0,7,0,1,0,1,5,0,0,"Quod autem Dardanus ab <i>Europa</i> originem duxerit, noster Vates in tertio cantat dicens: Est locus, Hesperiam Grai cognomine dicunt, terra antiqua, potens armis atque ubere glebe. Oenotri coluere viri; nunc fama minores Ytaliam dixisse ducis de nomine gentem: hee nobis proprie sedes, hinc Dardanus ortus.",Europa,Europa,https://dantesearch.dantenetwork.it/api.html?lemma=Europa,Mon. II iii 12,18,Monarchia,10,Europa
0,3,1,0,7,0,1,0,1,5,0,0,"Tertia Lavinia fuit, Albanorum mater, regis Latini filia pariter et heres, si verum est testimonium nostri Poete in ultimo, ubi Turnum victum introducit orantem suppliciter ad Eneam sic: Vicisti, et victum tendere palmas Ausonii videre: tua est Lavinia coniunx. Que ultima uxor de Ytalia fuit, <i>Europe</i> regione nobilissima.",Europe,Europa,https://dantesearch.dantenetwork.it/api.html?lemma=Europa,Mon. II iii 16,18,Monarchia,11,Europa
0,3,1,0,7,0,1,0,1,5,0,0,"Post hos vero Xerxes, Darii filius et rex in Persis, cum tanta gentium multitudine mundum invasit, cum tanta potentia, ut transitum maris Asyam ab <i>Europa</i> dirimentis inter Sexton et Abidon ponte superaverit. Cuius operis admirabilis Lucanus in secundo Farsalie memor fuit; canit enim ibi sic: Tales fama canit tumidum super equora Xerxem construxisse vias. Et tandem, miserabiliter ab incepto repulsus, ad bravium pervenire non potuit.",Europa,Europa,https://dantesearch.dantenetwork.it/api.html?lemma=Europa,Mon. II viii 7,18,Monarchia,12,Europa
0,3,1,0,7,0,1,0,1,5,0,0,"Quod vero ab aliquo Imperatore non receperit, per ea que superius manifesta sunt patet sufficienter. Et quod etiam ab assensu omnium vel prevalentium non habuerit quis dubitat, cum non modo Asyani et Affricani omnes, quinetiam maior pars <i>Europam</i> colentium hoc aborreat? Fastidium etenim est in rebus manifestissimis probationes adducere.",Europam,Europa,https://dantesearch.dantenetwork.it/api.html?lemma=Europa,Mon. III xiv 7,18,Monarchia,13,Europa
0,3,1,0,7,0,1,0,1,5,0,0,"ne lo stremo d' <i>Europa</i> si ritenne,",Europa,Europa,https://dantesearch.dantenetwork.it/api.html?lemma=Europa,Par. VI 5,18,Commedia - Paradiso,14,Europa
0,3,1,0,7,0,1,0,1,5,0,0,"di che si vede <i>Europa</i> rivestire,",Europa,Europa,https://dantesearch.dantenetwork.it/api.html?lemma=Europa,Par. XII 48,18,Commedia - Paradiso,15,Europa
0,3,1,0,7,0,1,0,1,5,0,0,qual si fece <i>Europa</i> dolce carco.,Europa,Europa,https://dantesearch.dantenetwork.it/api.html?lemma=Europa,Par. XXVII 84,18,Commedia - Paradiso,16,Europa
0,3,1,0,7,0,1,0,1,5,0,0,per tutta <i>Europa</i> ei non sien palesi?,Europa,Europa,https://dantesearch.dantenetwork.it/api.html?lemma=Europa,Purg. VIII 123,18,Commedia - Purgatorio,17,Europa
0,3,1,0,7,0,1,0,1,5,0,0,"paese d'<i>Europa, </i> che non perde","Europa,",Europa,https://dantesearch.dantenetwork.it/api.html?lemma=Europa,"Rime 43, 28",18,Le Rime,18,Europa
0,0,0,0,5,0,7,0,0,0,1,0,"Nos autem, cui mundus est patria velut piscibus equor, quanquam Sarnum biberimus ante dentes et <i>Florentiam</i> adeo diligamus ut, quia dileximus, exilium patiamur iniuste, rationi magis quam sensui spatulas nostri iudicii podiamus. Et quamvis ad voluptatem nostram sive nostre sensualitatis quietem in terris amenior locus quam Florentia non existat, revolventes et poetarum et aliorum scriptorum volumina quibus mundus universaliter et membratim describitur, in nobis situationes varias mundi locorum et eorum habitudinem ad utrunque polum et circulum equatorem, multas esse perpendimus censemus et magis nobiles et magis delitiosas et regiones et urbes quam Tusciam et Florentiam, unde sumus oriundus et civis, et plerasque nationes et gentes delectabiliori atque utiliori sermone uti quam Latinos.",Florentiam,Florentia,https://dantesearch.dantenetwork.it/api.html?lemma=Florentia,De vulg. I vi 3,13,De Vulgari Eloquentia,1,Florentia
0,0,0,0,5,0,7,0,0,0,1,0,"Nos autem, cui mundus est patria velut piscibus equor, quanquam Sarnum biberimus ante dentes et Florentiam adeo diligamus ut, quia dileximus, exilium patiamur iniuste, rationi magis quam sensui spatulas nostri iudicii podiamus. Et quamvis ad voluptatem nostram sive nostre sensualitatis quietem in terris amenior locus quam <i>Florentia</i> non existat, revolventes et poetarum et aliorum scriptorum volumina quibus mundus universaliter et membratim describitur, in nobis situationes varias mundi locorum et eorum habitudinem ad utrunque polum et circulum equatorem, multas esse perpendimus censemus et magis nobiles et magis delitiosas et regiones et urbes quam Tusciam et Florentiam, unde sumus oriundus et civis, et plerasque nationes et gentes delectabiliori atque utiliori sermone uti quam Latinos.",Florentia,Florentia,https://dantesearch.dantenetwork.it/api.html?lemma=Florentia,De vulg. I vi 3,13,De Vulgari Eloquentia,2,Florentia
0,0,0,0,5,0,7,0,0,0,1,0,"Nos autem, cui mundus est patria velut piscibus equor, quanquam Sarnum biberimus ante dentes et Florentiam adeo diligamus ut, quia dileximus, exilium patiamur iniuste, rationi magis quam sensui spatulas nostri iudicii podiamus. Et quamvis ad voluptatem nostram sive nostre sensualitatis quietem in terris amenior locus quam Florentia non existat, revolventes et poetarum et aliorum scriptorum volumina quibus mundus universaliter et membratim describitur, in nobis situationes varias mundi locorum et eorum habitudinem ad utrunque polum et circulum equatorem, multas esse perpendimus censemus et magis nobiles et magis delitiosas et regiones et urbes quam Tusciam et <i>Florentiam</i>, unde sumus oriundus et civis, et plerasque nationes et gentes delectabiliori atque utiliori sermone uti quam Latinos.",Florentiam,Florentia,https://dantesearch.dantenetwork.it/api.html?lemma=Florentia,De vulg. I vi 3,13,De Vulgari Eloquentia,3,Florentia
0,0,0,0,5,0,7,0,0,0,1,0,"Sed non minoris difficultatis accedit discretio priusquam quam querimus actingamus, videlicet urbanitate plenissimam. Sunt etenim gradus constructionum quamplures: videlicet insipidus, qui est rudium, ut “Petrus amat multum dominam Bertam”; est et pure sapidus, qui est rigidorum scolarium vel magistrorum, ut” Piget me cunctis pietate maiorem, quicunque in exilio tabescentes patriam tantum sompniando revisunt “; est et sapidus et venustus, qui est quorundam superficietenus rethoricam aurientium, ut” Laudabilis discretio marchionis Estensis, et sua magnificentia preparata, cunctis illum facit esse dilectum “; est et sapidus et venustus etiam et excelsus, qui est dictatoruml illustrium, ut” Eiecta maxima parte florum de sinu tuo, <i>Florentia</i>, nequicquam Trinacriam Totila secundus adivit “.",Florentia,Florentia,https://dantesearch.dantenetwork.it/api.html?lemma=Florentia,De vulg. II vi 4,13,De Vulgari Eloquentia,4,Florentia
0,0,0,0,5,0,7,0,0,0,1,0,"Horum prorsus, cum tragice poetari conamur, endecasillabum propter quandam excellentiam in contextu vincendi privilegium promeretur. Nam quedam stantia est que solis endecasillabis gaudet esse contexta, ut illa Guidonis de <i>Florentia</i> Donna me prega, perch'io voglio dire; et etiam nos dicimus Donne ch'avete intelletto d'amore. Hoc etiam Yspani usi sunt - et dico Yspanos qui poetati sunt in vulgari oc: Namericus de Belnui: Nuls hom non pot complir adrecciamen.",Florentia,Florentia,https://dantesearch.dantenetwork.it/api.html?lemma=Florentia,De vulg. II xii 3,13,De Vulgari Eloquentia,5,Florentia
0,0,0,0,5,0,7,0,0,0,1,0,"Reverendissimo in Christo patri dominorum suorum carissimo domino Nicholao miseratione celesti Ostiensi et Vallatrensi episcopo, Apostolice Sedis legato, necnon in Tuscia Romandiola et Marchia Trivisiana et partibus circum adiacentibus paciario per sacrosanctam Ecclesiam ordinato, devotissimi filii A. capitaneus, Consilium et Universitas partis Alborum de <i>Florentia</i> devotissime atque promptissime recommendant.",Florentia,Florentia,https://dantesearch.dantenetwork.it/api.html?lemma=Florentia,Ep. I 1,13,Epistole,6,Florentia
0,0,0,0,5,0,7,0,0,0,1,0,"Idcirco pietati clementissime vestre filiali voce affectuosissime supplicamus quatenus illam diu exagitatam <i>Florentiam</i> sopore tranquillitatis et pacis irrigare velitis, semper populum defensantes nos et que nostri sunt iuris, ut pius pater, commendatos habere; qui velud a patrie caritate nunquam destitimus, sic de preceptorum vestrorum limitibus nunquam exorbitare intendimus, sed semper tam debite quam devote quibuscunque vestris obedire mandatis.",Florentiam,Florentia,https://dantesearch.dantenetwork.it/api.html?lemma=Florentia,Ep. I 9,13,Epistole,7,Florentia
0,0,0,0,5,0,7,0,0,0,1,0,"An ignoras, excellentissime principum, nec de specula summe celsitudinis deprehendis ubi vulpecula fetoris istius, venantium secura, recumbat? Quippe nec Pado precipiti, nec Tiberi tuo criminosa potatur, verum Sarni fluenta torrentis adhuc rictus eius inficiunt, et <i>Florentia</i>, forte nescis?, dira hec pernicies nuncupatur.",Florentia,Florentia,https://dantesearch.dantenetwork.it/api.html?lemma=Florentia,Ep. VII 23,13,Epistole,8,Florentia
0,0,0,0,5,0,7,0,0,0,1,0,"Cardinalibus ytalicis Dantes de <i>Florentia</i>, etc.]",Florentia,Florentia,https://dantesearch.dantenetwork.it/api.html?lemma=Florentia,Ep. XI 1,13,Epistole,9,Florentia
0,0,0,0,5,0,7,0,0,0,1,0,"Ecce igitur quod per litteras vestras nepotis nec non aliorum quamplurium amicorum, significatum est michi per ordinamentum nuper factum <i>Florentie</i> super absolutione bannitorum quod si solvere vellem certam pecunie quantitatem pati notam oblationis, et absolvi possem et redire ad presens.",Florentie,Florentia,https://dantesearch.dantenetwork.it/api.html?lemma=Florentia,Ep. XII 4,13,Epistole,10,Florentia
0,0,0,0,5,0,7,0,0,0,1,0,"Non est hec via redeundi ad patriam, pater mi; sed si alia per vos ante aut deinde per alios invenitur, que fame honori non deroget, illam non lentis passibus acceptabo; quod si per nullam talem <i>Florentia</i> introitur, nunquam Florentiam introibo.",Florentia,Florentia,https://dantesearch.dantenetwork.it/api.html?lemma=Florentia,Ep. XII 9,13,Epistole,11,Florentia
0,0,0,0,5,0,7,0,0,0,1,0,"Non est hec via redeundi ad patriam, pater mi; sed si alia per vos ante aut deinde per alios invenitur, que fame honori non deroget, illam non lentis passibus acceptabo; quod si per nullam talem Florentia introitur, nunquam <i>Florentiam</i> introibo.",Florentiam,Florentia,https://dantesearch.dantenetwork.it/api.html?lemma=Florentia,Ep. XII 9,13,Epistole,12,Florentia
0,0,0,0,5,0,7,0,0,0,1,0,"Universis et singulis presentes litteras inspecturis, Dantes Alagherii de <i>Florentia</i> inter vere phylosophantes minimus, in Eo salutem qui est principium veritatis et lumen.",Florentia,Florentia,https://dantesearch.dantenetwork.it/api.html?lemma=Florentia,Questio 1,13,Questio de Aqua et Terra,13,Florentia
0,0,0,0,0,0,0,0,0,1,0,0,"Quantum vero ad hereditariam, quelibet pars tripartiti orbis tam avis quam coniugibus illum nobilitasse invenitur. Nam Asya propinquioribus avis, ut Assaraco et aliis qui <i>Frigiam</i> regnaverunt, Asye regionem; unde Poeta noster in tertio: Postquam res Asye evertere gentem inmeritam visum superis.",Frigiam,Frigia,https://dantesearch.dantenetwork.it/api.html?lemma=Frigia,Mon. II iii 10,1,Monarchia,1,Frigia
0,0,0,0,0,0,0,0,0,0,1,0,"Nam, ut comuniter ab omnibus habetur, hec habitabilis extenditur per lineam longitudinis a Gadibus, que supra terminos occidentales ab Hercule positos ponitur, usque ad hostia fluminis <i>Ganges</i>, ut scribit Orosius. Que quidem longitudo tanta est, ut occidente sole in equinoctiali existente illis qui sunt in altero terminorum, oritur illis qui sunt in altero, sicut per eclipsim lune compertum est ab astrologis. Igitur oportet terminos predicte longitudinis distare per clxxx gradus, que est dimidia distantia totius circumferentie.",Ganges,Ganges,https://dantesearch.dantenetwork.it/api.html?lemma=Ganges,Questio 54,1,Questio de Aqua et Terra,1,Ganges
