0,0,0,0,0,0,1,0,0,0,0,0,"Sin prorsus arrogantia vestra insolens adeo roris altissimi, ceu cacumina <i>Gelboe</i>, vos fecit exsortes, ut Senatus eterni consulto restitisse timori non fuerit, nec etiam non timuisse timetis; nunquid timor ille perniciosus, humanus videlicet atque mundanus, abesse poterit, superbissimi vestri sanguinis multum lacrimande rapine inevitabili naufragio properante?",Gelboe,Gelboe,https://dantesearch.dantenetwork.it/api.html?lemma=Gelboe,Ep. VI 11,1,Epistole,1,Gelboe
0,0,0,0,1,0,1,0,0,0,0,0,"Caveat ergo quilibet et discernat ea que dicimus, et quando pure hec tria cantare intendit, vel que ad ea directe ac pure secuntur, prius <i>Elicone</i> potatus, tensis fidibus ad supremum, secure plectrum tum movere incipiat.",Elicone,Helicon,https://dantesearch.dantenetwork.it/api.html?lemma=Helicon,De vulg. II iv 9,2,De Vulgari Eloquentia,1,Helicon
0,0,0,0,1,0,1,0,0,0,0,0,"Verum ne diuturna me nimis incertitudo suspenderet, velut Austri regina Ierusalem petiit, velut Pallas petiit <i>Elicona</i>, Veronam petii fidis oculis discursurus audita, magnalia vestra vidi, vidi beneficia simul et tetigi; et quemadmodum prius dictorum ex parte suspicabar excessum, sic posterius ipsa facta excessiva cognovi. Quo factum ut ex auditu solo cum quadam animi subiectione benivolus prius exstiterim, sed ex visu postmodum devotissimus et amicus.",Elicona,Helicon,https://dantesearch.dantenetwork.it/api.html?lemma=Helicon,Ep. XIII 3,2,Epistole,2,Helicon
0,0,0,0,0,0,1,0,0,1,0,0,"An septi vallo ridiculo cuiquam defensioni confiditis? O male concordes! o mira cupidine obcecati! Quid vallo sepsisse, quid propugnaculis et pinnis urbem armasse iuvabit, cum advolaverit aquila in auro terribilis, que nunc Pirenen, nunc Caucason, nunc Athlanta supervolans, militie celi magis confortata sufflamine, vasta maria quondam transvolando despexit? quid, cum adfore stupescetis, miserrimi hominum, delirantis <i>Hesperie</i> domitorem?",Hesperie,Hesperia,https://dantesearch.dantenetwork.it/api.html?lemma=Hesperia,Ep. VI 12,2,Epistole,1,Hesperia
0,0,0,0,0,0,1,0,0,1,0,0,"Est locus, <i>Hesperiam</i> Grai cognomine dicunt,",Hesperiam,Hesperia,https://dantesearch.dantenetwork.it/api.html?lemma=Hesperia,Mon. II iii 12,2,Monarchia,2,Hesperia
0,0,0,0,1,0,0,0,0,0,0,0,"Et dextri regiones sunt Apulia, sed non tota, Roma, Ducatus, Tuscia et Ianuensis Marchia; sinistri autem pars Apulie, Marchia Anconitana, Romandiola, Lombardia, Marchia Trivisiana cum Venetiis. Forum Iulii vero et <i>Ystria</i> non nisi leve Ytalie esse possunt; nec insule Tyreni maris, videlicet Sicilia et Sardinia, non nisi dextre Ytalie sunt, vel ad dextram Ytaliam sociande.",Ystria,Histria,https://dantesearch.dantenetwork.it/api.html?lemma=Histria,De vulg. I x 5,1,De Vulgari Eloquentia,1,Histria
0,0,0,0,0,0,4,0,0,1,0,0,"Nam qui virtutem honorabat in terris, nunc a Virtutibus honoratur in celis; et qui Romane aule palatinus erat in Tuscia, nunc regie sempiterne aulicus preelectus in superna <i>Ierusalem</i> cum beatorum principibus gloriatur.",Ierusalem,Ierusalem,https://dantesearch.dantenetwork.it/api.html?lemma=Ierusalem,Ep. II 6,5,Epistole,1,Ierusalem
0,0,0,0,0,0,4,0,0,1,0,0,"Tunc hereditas nostra, quam sine intermissione deflemus ablatam, nobis erit in integrum restituta; ac quemadmodum, sacrosancte <i>Ierusalem</i> memores, exules in Babilone gemiscimus, ita tunc cives et respirantes in pace, confusionis miserias in gaudio recolemus.",Ierusalem,Ierusalem,https://dantesearch.dantenetwork.it/api.html?lemma=Ierusalem,Ep. VII 30,5,Epistole,2,Ierusalem
0,0,0,0,0,0,4,0,0,1,0,0,"Quod quidem de specula punctalis eternitatis intuens qui solus eternus est, mentem Deo dignam viri prophetici per Spiritum Sanctum sua iussione impressit, et is sanctam <i>Ierusalem</i> velut exstinctam per verba presignata et nimium, proh dolor!, iterata deflevit.",Ierusalem,Ierusalem,https://dantesearch.dantenetwork.it/api.html?lemma=Ierusalem,Ep. XI 3,5,Epistole,3,Ierusalem
0,0,0,0,0,0,4,0,0,1,0,0,"Verum ne diuturna me nimis incertitudo suspenderet, velut Austri regina <i>Ierusalem</i> petiit, velut Pallas petiit Elicona, Veronam petii fidis oculis discursurus audita, magnalia vestra vidi, vidi beneficia simul et tetigi; et quemadmodum prius dictorum ex parte suspicabar excessum, sic posterius ipsa facta excessiva cognovi. Quo factum ut ex auditu solo cum quadam animi subiectione benivolus prius exstiterim, sed ex visu postmodum devotissimus et amicus.",Ierusalem,Ierusalem,https://dantesearch.dantenetwork.it/api.html?lemma=Ierusalem,Ep. XIII 3,5,Epistole,4,Ierusalem
0,0,0,0,0,0,4,0,0,1,0,0,"Hanc suam presumptionem scribe Cristi testantur omnes. Scribit autem Matheus, cum Iesus interrogasset discipulos «Quem me esse dicitis?», Petrum ante omnes respondisse: «Tu es Cristus, filius Dei vivi». Scribit etiam quod, cum Cristus diceret discipulis quia oportebat eum ire in <i>Ierusalem</i> et multa pati, Petrus assumpsit eum et cepit increpare illum dicens: «Absit a te, Domine; non erit tibi hoc»; ad quem Cristus, redarguens, conversus dixit: «Vade post me, Sathana».",Ierusalem,Ierusalem,https://dantesearch.dantenetwork.it/api.html?lemma=Ierusalem,Mon. III ix 10,5,Monarchia,5,Ierusalem
0,0,0,0,1,0,6,0,0,4,0,0,"Quibus autem sacratum ydioma remansit nec aderant nec exercitium commendabant, sed graviter detestantes stoliditatem operantium deridebant. Sed hec minima pars, quantum ad numerum, fuit de semine Sem, sicut conicio, qui fuit tertius filius Noe: de qua quidem ortus est populus <i>Israel</i>, qui antiquissima locutione sunt usi usque ad suam dispersionem.",Israel,Israel,https://dantesearch.dantenetwork.it/api.html?lemma=Israel,De vulg. I vii 8,11,De Vulgari Eloquentia,1,Israel
0,0,0,0,1,0,6,0,0,4,0,0,"Precaveant sacratissimi regis alta consilia, ne celeste iudicium Samuelis illa verba reasperet: «Nonne cum parvulus esses in oculis tuis, caput in tribubus <i>Israel</i> factus es, te Dominus in regem super Israel, et misit te Deus in via et ait: Vade et interfice peccatores Amalech?». Nam et tu in regem sacratus es ut Amalech percutias et Agag non pareas, atque ulciscaris Illum qui misit te de gente brutali et de festina sua sollempnitate; que quidem et Amalech et Agag sonare dicuntur.",Israel,Israel,https://dantesearch.dantenetwork.it/api.html?lemma=Israel,Ep. VII 19,11,Epistole,2,Israel
0,0,0,0,1,0,6,0,0,4,0,0,"Precaveant sacratissimi regis alta consilia, ne celeste iudicium Samuelis illa verba reasperet: «Nonne cum parvulus esses in oculis tuis, caput in tribubus Israel factus es, te Dominus in regem super <i>Israel</i>, et misit te Deus in via et ait: Vade et interfice peccatores Amalech?». Nam et tu in regem sacratus es ut Amalech percutias et Agag non pareas, atque ulciscaris Illum qui misit te de gente brutali et de festina sua sollempnitate; que quidem et Amalech et Agag sonare dicuntur.",Israel,Israel,https://dantesearch.dantenetwork.it/api.html?lemma=Israel,Ep. VII 19,11,Epistole,3,Israel
0,0,0,0,1,0,6,0,0,4,0,0,"Eia itaque, rumpe moras, proles altera Isai, sume tibi fiduciam de oculis Domini Dei Sabaoth coram quo agis, et Goliam hunc in funda sapientie tue atque in lapide virium tuarum prosterne; quoniam in eius occasu nox et umbra timoris castra Philistinorum operiet: fugient Philistei et liberabitur <i>Israel</i>.",Israel,Israel,https://dantesearch.dantenetwork.it/api.html?lemma=Israel,Ep. VII 29,11,Epistole,4,Israel
0,0,0,0,1,0,6,0,0,4,0,0,"Qui modus tractandi, ut melius pateat, potest considerari in hiis versibus: «In exitu <i>Israel</i> de Egipto, domus Iacob de populo barbaro, facta est Iudea sanctificatio eius, Israel potestas eius». Nam si ad litteram solam inspiciamus, significatur nobis exitus filiorum Israel de Egipto, tempore Moysis; si ad allegoriam, nobis significatur nostra redemptio facta per Christum; si ad moralem sensum, significatur nobis conversio anime de luctu et miseria peccati ad statum gratie; si ad anagogicum, significatur exitus anime sancte ab huius corruptionis servitute ad eterne glorie libertatem.",Israel,Israel,https://dantesearch.dantenetwork.it/api.html?lemma=Israel,Ep. XIII 21,11,Epistole,5,Israel
0,0,0,0,1,0,6,0,0,4,0,0,"Qui modus tractandi, ut melius pateat, potest considerari in hiis versibus: «In exitu Israel de Egipto, domus Iacob de populo barbaro, facta est Iudea sanctificatio eius, <i>Israel</i> potestas eius». Nam si ad litteram solam inspiciamus, significatur nobis exitus filiorum Israel de Egipto, tempore Moysis; si ad allegoriam, nobis significatur nostra redemptio facta per Christum; si ad moralem sensum, significatur nobis conversio anime de luctu et miseria peccati ad statum gratie; si ad anagogicum, significatur exitus anime sancte ab huius corruptionis servitute ad eterne glorie libertatem.",Israel,Israel,https://dantesearch.dantenetwork.it/api.html?lemma=Israel,Ep. XIII 21,11,Epistole,6,Israel
0,0,0,0,1,0,6,0,0,4,0,0,"Qui modus tractandi, ut melius pateat, potest considerari in hiis versibus: «In exitu Israel de Egipto, domus Iacob de populo barbaro, facta est Iudea sanctificatio eius, Israel potestas eius». Nam si ad litteram solam inspiciamus, significatur nobis exitus filiorum <i>Israel</i> de Egipto, tempore Moysis; si ad allegoriam, nobis significatur nostra redemptio facta per Christum; si ad moralem sensum, significatur nobis conversio anime de luctu et miseria peccati ad statum gratie; si ad anagogicum, significatur exitus anime sancte ab huius corruptionis servitute ad eterne glorie libertatem.",Israel,Israel,https://dantesearch.dantenetwork.it/api.html?lemma=Israel,Ep. XIII 21,11,Epistole,7,Israel
0,0,0,0,1,0,6,0,0,4,0,0,"Sed genus humanum maxime Deo assimilatur quando maxime est unum: vera enim ratio unius in solo illo est; propter quod scriptum est: «Audi, <i>Israel</i>, Dominus Deus tuus unus est».",Israel,Israel,https://dantesearch.dantenetwork.it/api.html?lemma=Israel,Mon. I viii 3,11,Monarchia,8,Israel
0,0,0,0,1,0,6,0,0,4,0,0,"Hoc etiam factum fuisse per ipsum ipse Moyses in lege conscribit, qui, assumptis primatibus de tribubus filiorum <i>Israel</i>, eis inferiora iudicia relinquebat, superiora et comuniora sibi soli reservans, quibus comunioribus utebantur primates per tribus, secundum quod unicuique tribui competebat.",Israel,Israel,https://dantesearch.dantenetwork.it/api.html?lemma=Israel,Mon. I xiv 9,11,Monarchia,9,Israel
0,0,0,0,1,0,6,0,0,4,0,0,"Nam hoc ratio humana per se iustum intueri non potest, fide tamen adiuta potest. Scriptum est enim ad Hebreos: «Inpossibile est sine fide placere Deo»; et in Levitico: «Homo quilibet de domo <i>Israel</i>, qui occiderit bovem aut ovem aut capram in castris vel extra castra et non obtulerit ad hostium tabernaculi oblationem Domino, sanguinis reus erit».",Israel,Israel,https://dantesearch.dantenetwork.it/api.html?lemma=Israel,Mon. II vii 5,11,Monarchia,10,Israel
0,0,0,0,1,0,6,0,0,4,0,0,"Simplici revelatione dupliciter: aut sponte Dei, aut oratione impetrante; sponte Dei dupliciter: aut expresse, aut per signum; expresse, sicut revelatum fuit iudicium Samueli contra Saulem; per signum, sicut Pharaoni revelatum fuit per signa quod Deus iudicaverat de liberatione filiorum <i>Israel</i>. Oratione impetrante, quod sciebant qui dicebant secundo Paralipomenon: «Cum ignoramus quid agere debeamus, hoc solum habemus residui: ut oculos nostros ad Te dirigamus».",Israel,Israel,https://dantesearch.dantenetwork.it/api.html?lemma=Israel,Mon. II vii 8,11,Monarchia,11,Israel
3,2,6,10,19,0,9,0,0,5,0,0,"Onde vedemo cittadi d' <i>Italia</i>, se bene volemo aguardare, da cinquanta anni in qua molti vocaboli essere spenti e nati e variati; onde se 'l picciol tempo così transmuta, molto più transmuta lo maggiore. Sì ch' io dico che se coloro che partiro d' esta vita già sono mille anni tornassero loro cittadi, crederebbero la loro cittade essere occupata da gente strana, per la lingua loro discordante.",Italia,Italia,https://dantesearch.dantenetwork.it/api.html?lemma=Italia,Conv. I v 9,54,Convivio,1,Italia
3,2,6,10,19,0,9,0,0,5,0,0,"Ma questo non è: ché uno abituato di latino non distingue, s' elli è d' <i>Italia</i>, lo volgare inghilese tedesco; né lo tedesco, lo volgare italico provinciale. Onde è manifesto che lo latino non è conoscente volgare.",Italia,Italia,https://dantesearch.dantenetwork.it/api.html?lemma=Italia,Conv. I vi 8,54,Convivio,2,Italia
3,2,6,10,19,0,9,0,0,5,0,0,"A perpetuale infamia e depressione malvagi uomini d' <i>Italia</i>, che commendano lo volgare altrui e lo loro propio dispregiano, dico che la loro mossa viene da cinque abominevoli cagioni.",Italia,Italia,https://dantesearch.dantenetwork.it/api.html?lemma=Italia,Conv. I xi 1,54,Convivio,3,Italia
3,2,6,10,19,0,9,0,0,5,0,0,"E tutti questi cotali sono li abominevoli cattivi d' <i>Italia</i> che hanno a vile questo prezioso volgare: lo quale, s' è vile in alcuna cosa, non è se non in quanto ello suona bocca meretrice di questi adulteri; cui condutto vanno li ciechi quali prima cagione feci menzione.",Italia,Italia,https://dantesearch.dantenetwork.it/api.html?lemma=Italia,Conv. I xi 21,54,Convivio,4,Italia
3,2,6,10,19,0,9,0,0,5,0,0,"Cortesia e onestade è tutt' uno: e però che corti anticamente le vertudi e li belli costumi s' usavano, sì come oggi s' usa lo contrario, si tolse quello vocabulo corti, e fu tanto a dire cortesia quanto uso di corte. Lo qual vocabulo se oggi si togliesse corti, massimamente d' <i>Italia</i>, non sarebbe altro a dire che turpezza.",Italia,Italia,https://dantesearch.dantenetwork.it/api.html?lemma=Italia,Conv. II x 8,54,Convivio,5,Italia
3,2,6,10,19,0,9,0,0,5,0,0,"Dico adunque che anticamente in <i>Italia</i>, quasi principio constituzione di Roma che fu settecento cinquanta anni innanzi, o poco più meno, che 'l Salvatore venisse, secondo che scrive Paulo Orosio tempo quasi che Numma Pompilio, secondo re Romani, vivea uno filosofo nobilissimo che si chiamò Pittagora. E che ello fosse in quel tempo, pare che ne tocchi alcuna cosa Tito Livio prima parte suo volume incidentemente.",Italia,Italia,https://dantesearch.dantenetwork.it/api.html?lemma=Italia,Conv. III xi 3,54,Convivio,6,Italia
3,2,6,10,19,0,9,0,0,5,0,0,"E tutto questo fu in uno temporale, che David nacque e nacque Roma, cioè che Enea venne di Troia in <i>Italia</i>, che fu origine cittade romana, sì come testimoniano le scritture. Per che assai è manifesto la divina elezione romano imperio, per lo nascimento santa cittade, che fu contemporaneo radice progenie di Maria.",Italia,Italia,https://dantesearch.dantenetwork.it/api.html?lemma=Italia,Conv. IV v 6,54,Convivio,7,Italia
3,2,6,10,19,0,9,0,0,5,0,0,"Oh ineffabile e incomprensibile sapienza di Dio, che a una ora, per la tua venuta, in Siria suso e qua in <i>Italia</i> tanto dinanzi ti preparasti! E oh stoltissime e vilissime bestiuole che a guisa d' uomo voi pascete, che presummete contra nostra fede parlare e volete sapere, filando e zappando, ciò che Iddio con tanta prudenza hae ordinato! Maladetti siate voi, e la vostra presunzione, e chi a voi crede!",Italia,Italia,https://dantesearch.dantenetwork.it/api.html?lemma=Italia,Conv. IV v 9,54,Convivio,8,Italia
3,2,6,10,19,0,9,0,0,5,0,0,"mente, nemici di Dio, fianchi, voi che le verghe reggimenti d' <i>Italia</i> prese avete —e dico a voi, Carlo e Federigo regi, e a voi altri principi e tiranni—; guardate chi a lato vi siede per consiglio, e annumerate quante volte lo die questo fine umana vita per li vostri consiglieri v' è additato! Meglio sarebbe a voi come rondine volare basso, che come nibbio altissime rote fare sopra le cose vilissime!",Italia,Italia,https://dantesearch.dantenetwork.it/api.html?lemma=Italia,Conv. IV vi 20,54,Convivio,9,Italia
3,2,6,10,19,0,9,0,0,5,0,0,"Per questa ragione, in ciascuna arte e in ciascuno mestiere li artefici e li discenti sono, ed essere deono, subietti prencipe e maestro di quelle, in quello mestieri ed in quella arte; e fuori di quello la subiezione père, però che pere lo principato. Sì che quasi dire si può Imperadore, volendo lo suo officio figurare con una imagine, che elli sia lo cavalcatore umana volontade. Lo quale cavallo come vada sanza lo cavalcatore per lo campo assai è manifesto, e spezialmente misera <i>Italia</i>, che sanza mezzo alcuno sua gubernazione è rimasa!",Italia,Italia,https://dantesearch.dantenetwork.it/api.html?lemma=Italia,Conv. IV ix 10,54,Convivio,10,Italia
3,2,6,10,19,0,9,0,0,5,0,0,"Istorum vero proferentes meridionalis Europe tenent partem occidentalem, a Ianuensium finibus incipientes. Qui autem dicunt a predictis finibus orientalem tenent, videlicet usque ad promuntorium illud <i>Ytalie</i> qua sinus Adriatici maris incipit, et Siciliam. Sed loquentes quodam modo septentrionales sunt respectu istorum: nam ab oriente Alamannos habent et ab occidente et septentrione anglico mari vallati sunt et montibus Aragonie terminati; a meridie quoque Provincialibus et Apenini devexione clauduntur.",Ytalie,Italia,https://dantesearch.dantenetwork.it/api.html?lemma=Italia,De vulg. I viii 6,54,De Vulgari Eloquentia,11,Italia
3,2,6,10,19,0,9,0,0,5,0,0,"Quare autem tripharie principalius variatum sit, investigemus; et quare quelibet istarum variationum in se ipsa variatur, puta dextre <i>Ytalie</i> locutio ab ea que est sinistre (nam aliter Paduani et aliter Pisani locuntur); et quare vicinius habitantes adhuc discrepant in loquendo, ut Mediolanenses et Veronenses, Romani et Florentini, nec non convenientes in eodem genere gentis, ut Neapoletani et Caetani, Ravennates et Faventini, et, quod mirabilius est, sub eadem civilitate morantes, ut Bononienses Burgi Sancti Felicis et Bononienses Strate Maioris.",Ytalie,Italia,https://dantesearch.dantenetwork.it/api.html?lemma=Italia,De vulg. I ix 4,54,De Vulgari Eloquentia,12,Italia
3,2,6,10,19,0,9,0,0,5,0,0,"Et dextri regiones sunt Apulia, sed non tota, Roma, Ducatus, Tuscia et Ianuensis Marchia; sinistri autem pars Apulie, Marchia Anconitana, Romandiola, Lombardia, Marchia Trivisiana cum Venetiis. Forum Iulii vero et Ystria non nisi leve <i>Ytalie</i> esse possunt; nec insule Tyreni maris, videlicet Sicilia et Sardinia, non nisi dextre Ytalie sunt, vel ad dextram Ytaliam sociande.",Ytalie,Italia,https://dantesearch.dantenetwork.it/api.html?lemma=Italia,De vulg. I x 5,54,De Vulgari Eloquentia,13,Italia
3,2,6,10,19,0,9,0,0,5,0,0,"Et dextri regiones sunt Apulia, sed non tota, Roma, Ducatus, Tuscia et Ianuensis Marchia; sinistri autem pars Apulie, Marchia Anconitana, Romandiola, Lombardia, Marchia Trivisiana cum Venetiis. Forum Iulii vero et Ystria non nisi leve Ytalie esse possunt; nec insule Tyreni maris, videlicet Sicilia et Sardinia, non nisi dextre <i>Ytalie</i> sunt, vel ad dextram Ytaliam sociande.",Ytalie,Italia,https://dantesearch.dantenetwork.it/api.html?lemma=Italia,De vulg. I x 5,54,De Vulgari Eloquentia,14,Italia
3,2,6,10,19,0,9,0,0,5,0,0,"Et dextri regiones sunt Apulia, sed non tota, Roma, Ducatus, Tuscia et Ianuensis Marchia; sinistri autem pars Apulie, Marchia Anconitana, Romandiola, Lombardia, Marchia Trivisiana cum Venetiis. Forum Iulii vero et Ystria non nisi leve Ytalie esse possunt; nec insule Tyreni maris, videlicet Sicilia et Sardinia, non nisi dextre Ytalie sunt, vel ad dextram <i>Ytaliam</i> sociande.",Ytaliam,Italia,https://dantesearch.dantenetwork.it/api.html?lemma=Italia,De vulg. I x 5,54,De Vulgari Eloquentia,15,Italia
3,2,6,10,19,0,9,0,0,5,0,0,"Quare adminus xiiii vulgaribus sola videtur <i>Ytalia</i> variari. Que adhuc omnia vulgaria in sese variantur, ut puta in Tuscia Senenses et Aretini, in Lombardia Ferrarenses et Placentini; nec non in eadem civitate aliqualem variationem perpendimus, ut superius in capitulo inmediato posuimus. Quapropter, si primas et secundarias et subsecundarias vulgaris Ytalie variationes calculare velimus, et in hoc minimo mundi angulo non solum ad millenam loquele variationem venire contigerit, sed etiam ad magis ultra.",Ytalia,Italia,https://dantesearch.dantenetwork.it/api.html?lemma=Italia,De vulg. I x 7,54,De Vulgari Eloquentia,16,Italia
3,2,6,10,19,0,9,0,0,5,0,0,"Quare adminus xiiii vulgaribus sola videtur Ytalia variari. Que adhuc omnia vulgaria in sese variantur, ut puta in Tuscia Senenses et Aretini, in Lombardia Ferrarenses et Placentini; nec non in eadem civitate aliqualem variationem perpendimus, ut superius in capitulo inmediato posuimus. Quapropter, si primas et secundarias et subsecundarias vulgaris <i>Ytalie</i> variationes calculare velimus, et in hoc minimo mundi angulo non solum ad millenam loquele variationem venire contigerit, sed etiam ad magis ultra.",Ytalie,Italia,https://dantesearch.dantenetwork.it/api.html?lemma=Italia,De vulg. I x 7,54,De Vulgari Eloquentia,17,Italia
3,2,6,10,19,0,9,0,0,5,0,0,"Quam multis varietatibus latio dissonante vulgari, decentiorem atque illustrem <i>Ytalie</i> venemur loquelam; et ut nostre venationi pervium callem habere possimus, perplexos frutices atque sentes prius eiciamus de silva.",Ytalie,Italia,https://dantesearch.dantenetwork.it/api.html?lemma=Italia,De vulg. I xi 1,54,De Vulgari Eloquentia,18,Italia
3,2,6,10,19,0,9,0,0,5,0,0,"Quapropter superiora notantibus innotescere debet nec siculum nec apulum esse illud quod in <i>Ytalia</i> pulcerrimum est vulgare, cum eloquentes indigenas ostenderimus a proprio divertisse.",Ytalia,Italia,https://dantesearch.dantenetwork.it/api.html?lemma=Italia,De vulg. I xii 9,54,De Vulgari Eloquentia,19,Italia
3,2,6,10,19,0,9,0,0,5,0,0,"Transeuntes nunc humeros Apenini frondiferos levam <i>Ytaliam</i> contatim venemur ceu solemus, orientaliter ineuntes.",Ytaliam,Italia,https://dantesearch.dantenetwork.it/api.html?lemma=Italia,De vulg. I xiv 1,54,De Vulgari Eloquentia,20,Italia
3,2,6,10,19,0,9,0,0,5,0,0,"de residuis in extremis <i>Ytalie</i> civitatibus neminem dubitare pendamus - et si quis dubitat, illum nulla nostra solutione dignamur -, parum restat in nostra discussione dicendum. Quare, cribellum cupientes deponere, ut residentiam cito visamus, dicimus Tridentum atque Taurinum nec non Alexandriam civitates metis Ytalie in tantum sedere propinquas quod puras nequeunt habere loquelas; ita quod si etiam quod turpissimum habent vulgare, haberent pulcerrimum, propter aliorum commixtionem esse vere latium negaremus. Quare, si latium illustre venamur, quod venamur in illis inveniri non potest.",Ytalie,Italia,https://dantesearch.dantenetwork.it/api.html?lemma=Italia,De vulg. I xv 7,54,De Vulgari Eloquentia,21,Italia
3,2,6,10,19,0,9,0,0,5,0,0,"de residuis in extremis Ytalie civitatibus neminem dubitare pendamus - et si quis dubitat, illum nulla nostra solutione dignamur -, parum restat in nostra discussione dicendum. Quare, cribellum cupientes deponere, ut residentiam cito visamus, dicimus Tridentum atque Taurinum nec non Alexandriam civitates metis <i>Ytalie</i> in tantum sedere propinquas quod puras nequeunt habere loquelas; ita quod si etiam quod turpissimum habent vulgare, haberent pulcerrimum, propter aliorum commixtionem esse vere latium negaremus. Quare, si latium illustre venamur, quod venamur in illis inveniri non potest.",Ytalie,Italia,https://dantesearch.dantenetwork.it/api.html?lemma=Italia,De vulg. I xv 7,54,De Vulgari Eloquentia,22,Italia
3,2,6,10,19,0,9,0,0,5,0,0,"Postquam venati saltus et pascua sumus <i>Ytalie</i>, nec pantheram quam sequimur adinvenimus, ut ipsam reperire possimus rationabilius investigemus de illa ut, solerti studio, redolentem ubique et necubi apparentem nostris penitus irretiamus tenticulis.",Ytalie,Italia,https://dantesearch.dantenetwork.it/api.html?lemma=Italia,De vulg. I xvi 1,54,De Vulgari Eloquentia,23,Italia
3,2,6,10,19,0,9,0,0,5,0,0,"que quidem nobilissima sunt earum que Latinorum sunt actiones. Hec nullius civitatis <i>Ytalie</i> propria sunt, et in omnibus comunia sunt: inter que nunc potest illud discerni vulgare quod superius venabamur, quod in qualibet redolet civitate nec cubat in ulla.",Ytalie,Italia,https://dantesearch.dantenetwork.it/api.html?lemma=Italia,De vulg. I xvi 4,54,De Vulgari Eloquentia,24,Italia
3,2,6,10,19,0,9,0,0,5,0,0,"Sed dicere quod in excellentissima Ytalorum curia sit libratum, videtur nugatio, cum curia careamus. Ad quod facile respondetur. Nam licet curia, secundum quod unita accipitur, ut curia regis Alamannie, in <i>Ytalia</i> non sit, membra tamen eius non desunt; et sicut membra illius uno Principe uniuntur, sic membra huius gratioso lumine rationis unita sunt. Quare falsum esset dicere curia carere Ytalos, quanquam Principe careamus, quoniam curiam habemus, licet corporaliter sit dispersa.",Ytalia,Italia,https://dantesearch.dantenetwork.it/api.html?lemma=Italia,De vulg. I xviii 5,54,De Vulgari Eloquentia,25,Italia
3,2,6,10,19,0,9,0,0,5,0,0,"Hoc autem vulgare quod illustre, cardinale, aulicum et curiale ostensum est, dicimus esse illud quod vulgare latium appellatur. Nam sicut quoddam vulgare est invenire quod proprium est Cremone, sic quoddam est invenire quod proprium est Lombardie; et sicut est invenire aliquod quod sit proprium Lombardie, est invenire aliquod quod sit totius sinistre <i>Ytalie</i> proprium; et sicut omnia hec est invenire, sic et illud quod totius Ytalie est. Et sicut illud cremonense ac illud lombardum et tertium semilatium dicitur, sic istud, quod totius Ytalie est, latium vulgare vocatur. Hoc enim usi sunt doctores illustres qui lingua vulgari poetati sunt in Ytalia, ut Siculi, Apuli, Tusci, Romandioli, Lombardi et utriusque Marchie viri.",Ytalie,Italia,https://dantesearch.dantenetwork.it/api.html?lemma=Italia,De vulg. I xix 1,54,De Vulgari Eloquentia,26,Italia
