Commedia - Inferno,Commedia - Paradiso,Commedia - Purgatorio,Convivio,De Vulgari Eloquentia,Egloge,Epistole,Il Fiore,Le Rime,Monarchia,Questio de Aqua et Terra,Vita Nuova,contesto,forma,lemma,link,luogo,occorrenze_totali,opera,posizione,toponimo
0,0,0,0,0,0,0,0,0,1,0,0,"Post hos vero Xerxes, Darii filius et rex in Persis, cum tanta gentium multitudine mundum invasit, cum tanta potentia, ut transitum maris Asyam ab Europa dirimentis inter Sexton et <i>Abidon</i> ponte superaverit. Cuius operis admirabilis Lucanus in secundo Farsalie memor fuit; canit enim ibi sic: Tales fama canit tumidum super equora Xerxem construxisse vias. Et tandem, miserabiliter ab incepto repulsus, ad bravium pervenire non potuit.",Abidon,Abidos,https://dantesearch.dantenetwork.it/api.html?lemma=Abidos,Mon. II viii 7,1,Monarchia,1,Abidos
0,0,0,0,0,1,0,0,0,0,0,0,"me colere, Emilida qua terminat <i>Adria</i> terram,",Adria,Adria,https://dantesearch.dantenetwork.it/api.html?lemma=Adria,Eg. IV 68,1,Egloge,1,Adria
0,0,0,0,0,0,2,0,0,3,0,0,"Qui modus tractandi, ut melius pateat, potest considerari in hiis versibus: «In exitu Israel de <i>Egipto</i>, domus Iacob de populo barbaro, facta est Iudea sanctificatio eius, Israel potestas eius». Nam si ad litteram solam inspiciamus, significatur nobis exitus filiorum Israel de Egipto, tempore Moysis; si ad allegoriam, nobis significatur nostra redemptio facta per Christum; si ad moralem sensum, significatur nobis conversio anime de luctu et miseria peccati ad statum gratie; si ad anagogicum, significatur exitus anime sancte ab huius corruptionis servitute ad eterne glorie libertatem.",Egipto,Aegyptus,https://dantesearch.dantenetwork.it/api.html?lemma=Aegyptus,Ep. XIII 21,5,Epistole,1,Aegyptus
0,0,0,0,0,0,2,0,0,3,0,0,"Qui modus tractandi, ut melius pateat, potest considerari in hiis versibus: «In exitu Israel de Egipto, domus Iacob de populo barbaro, facta est Iudea sanctificatio eius, Israel potestas eius». Nam si ad litteram solam inspiciamus, significatur nobis exitus filiorum Israel de <i>Egipto</i>, tempore Moysis; si ad allegoriam, nobis significatur nostra redemptio facta per Christum; si ad moralem sensum, significatur nobis conversio anime de luctu et miseria peccati ad statum gratie; si ad anagogicum, significatur exitus anime sancte ab huius corruptionis servitute ad eterne glorie libertatem.",Egipto,Aegyptus,https://dantesearch.dantenetwork.it/api.html?lemma=Aegyptus,Ep. XIII 21,5,Epistole,2,Aegyptus
0,0,0,0,0,0,2,0,0,3,0,0,"Secundus Vesoges, rex <i>Egipti</i>, ad hoc bravium spiravit; et quamvis meridiem atque septentrionem in Asya exagitaverit, ut Orosius memorat, nunquam tamen dimidiam partem orbis obtinuit; quin ymo a Scithis inter quasi athlotetas et terminum ab incepto suo temerario est aversus.",Egipti,Aegyptus,https://dantesearch.dantenetwork.it/api.html?lemma=Aegyptus,Mon. II viii 5,5,Monarchia,3,Aegyptus
0,0,0,0,0,0,2,0,0,3,0,0,"Preter istos et post, Alexander rex Macedo maxime omnium ad palmam Monarchie propinquans, dum per legatos ad deditionem Romanos premoneret, apud <i>Egiptum</i> ante Romanorum responsionem, ut Livius narrat, in medio quasi cursu collapsus est.",Egiptum,Aegyptus,https://dantesearch.dantenetwork.it/api.html?lemma=Aegyptus,Mon. II viii 8,5,Monarchia,4,Aegyptus
0,0,0,0,0,0,2,0,0,3,0,0,"De cuius etiam sepultura ibidem existente Lucanus in octavo, invehens in Ptolomeum regem <i>Egipti</i>, testimonium reddit dicens: Ultima Lagee stirpis proles degener, inceste sceptris cessure sororis, cum tibi sacrato Macedo servetur in antro.",Egipti,Aegyptus,https://dantesearch.dantenetwork.it/api.html?lemma=Aegyptus,Mon. II viii 9,5,Monarchia,5,Aegyptus
0,0,0,3,0,0,0,0,0,5,0,0,"Onde si legge storie d' Ercule e Ovidio Maggiore e in Lucano e in altri poeti che, combattendo Ercule gigante che si chiamava Anteo, tutte le volte che lo gigante era stanco ed elli ponea lo suo corpo sovra la terra disteso o per sua volontà o per forza d' Ercule, forza e vigore interamente terra in lui risurgea, quale e quale era esso generato. Di che Ercule, fine prese lui; e stringendo quello e terra, tanto lo tenne sanza terra ricongiugnere, che lo vinse per soperchio e uccise. E questa battaglia fu in <i>Africa</i>, secondo le testimonianze scritture.",Africa,Africa,https://dantesearch.dantenetwork.it/api.html?lemma=Africa,Conv. III iii 8,8,Convivio,1,Africa
0,0,0,3,0,0,0,0,0,5,0,0,"E non puose Iddio le mani, quando per la guerra d' Annibale avendo perduti tanti cittadini che tre moggia d' anella in <i>Africa</i> erano portate, li Romani volsero abandonare la terra, se quel benedetto Scipione giovane non avesse impresa l' andata in Africa per la sua franchezza? E non puose Iddio le mani quando uno nuovo cittadino di picciola condizione, cioè Tulio, contra tanto cittadino quanto era Catellina la romana libertate difese? Certo sì.",Africa,Africa,https://dantesearch.dantenetwork.it/api.html?lemma=Africa,Conv. IV v 19,8,Convivio,2,Africa
0,0,0,3,0,0,0,0,0,5,0,0,"E non puose Iddio le mani, quando per la guerra d' Annibale avendo perduti tanti cittadini che tre moggia d' anella in Africa erano portate, li Romani volsero abandonare la terra, se quel benedetto Scipione giovane non avesse impresa l' andata in <i>Africa</i> per la sua franchezza? E non puose Iddio le mani quando uno nuovo cittadino di picciola condizione, cioè Tulio, contra tanto cittadino quanto era Catellina la romana libertate difese? Certo sì.",Africa,Africa,https://dantesearch.dantenetwork.it/api.html?lemma=Africa,Conv. IV v 19,8,Convivio,3,Africa
0,0,0,3,0,0,0,0,0,5,0,0,"Quod vero Athlas de <i>Affrica</i> fuerit, mons in illa suo nomine dictus est testis, quem esse in Affrica dicit Orosius in sua mundi descriptione sic: «Ultimus autem finis eius est mons Athlas et insule quas Fortunatas vocant»; “eius”, idest Affrice, quia de ipsa loquebatur.",Affrica,Africa,https://dantesearch.dantenetwork.it/api.html?lemma=Africa,Mon. II iii 13,8,Monarchia,4,Africa
0,0,0,3,0,0,0,0,0,5,0,0,"Quod vero Athlas de Affrica fuerit, mons in illa suo nomine dictus est testis, quem esse in <i>Affrica</i> dicit Orosius in sua mundi descriptione sic: «Ultimus autem finis eius est mons Athlas et insule quas Fortunatas vocant»; “eius”, idest Affrice, quia de ipsa loquebatur.",Affrica,Africa,https://dantesearch.dantenetwork.it/api.html?lemma=Africa,Mon. II iii 13,8,Monarchia,5,Africa
0,0,0,3,0,0,0,0,0,5,0,0,"Quod vero Athlas de Affrica fuerit, mons in illa suo nomine dictus est testis, quem esse in Affrica dicit Orosius in sua mundi descriptione sic: «Ultimus autem finis eius est mons Athlas et insule quas Fortunatas vocant»; “eius”, idest <i>Affrice</i>, quia de ipsa loquebatur.",Affrice,Africa,https://dantesearch.dantenetwork.it/api.html?lemma=Africa,Mon. II iii 13,8,Monarchia,6,Africa
0,0,0,3,0,0,0,0,0,5,0,0,"Secunda Dido fuit, regina et mater Cartaginensium in <i>Affrica</i>; et quod fuerit coniunx, Idem noster vaticinatur in quarto; inquit enim de Didone: Nec iam furtivum Dido meditatur amorem: coniugium vocat; hoc pretexit nomine culpam.",Affrica,Africa,https://dantesearch.dantenetwork.it/api.html?lemma=Africa,Mon. II iii 15,8,Monarchia,7,Africa
0,0,0,3,0,0,0,0,0,5,0,0,"In hiis vero que De offitiis, de Catone dicebat: «Non enim alia in causa Marcus Cato fuit, alia ceteri qui se in <i>Affrica</i> Cesari tradiderunt. Atque ceteris forsan vitio datum esset si se interemissent, propterea quod levior eorum vita et mores fuerunt faciliores; Catoni vero cum incredibilem natura tribuisset gravitatem, perpetua constantia roborasset, in proposito consilio permansisset, moriendum ei potius quam tyrampni vultus aspiciendus fuit».",Affrica,Africa,https://dantesearch.dantenetwork.it/api.html?lemma=Africa,Mon. II v 17,8,Monarchia,8,Africa
0,0,0,0,0,0,0,0,0,1,0,0,"Europa vero avo antiquissimo, scilicet Dardano: <i>Affrica</i> quoque avia vetustissima, Electra scilicet, nata magni nominis regis Athlantis; ut de ambobus testimonium reddit Poeta noster in octavo, ubi Eneas ad Evandrum sic ait: Dardanus yliace primus pater urbis et auctor, Electra, ut Grai perhibent, Athlantide cretus, advehitur Teucros: Electram maximus Athlas edidit, ethereos humero qui sustinet orbes.",Affrica,Affrica,https://dantesearch.dantenetwork.it/api.html?lemma=Affrica,Mon. II iii 11,1,Monarchia,1,Affrica
0,0,0,0,1,0,0,0,0,0,0,0,"Sed dicere quod in excellentissima Ytalorum curia sit libratum, videtur nugatio, cum curia careamus. Ad quod facile respondetur. Nam licet curia, secundum quod unita accipitur, ut curia regis <i>Alamannie</i>, in Ytalia non sit, membra tamen eius non desunt; et sicut membra illius uno Principe uniuntur, sic membra huius gratioso lumine rationis unita sunt. Quare falsum esset dicere curia carere Ytalos, quanquam Principe careamus, quoniam curiam habemus, licet corporaliter sit dispersa.",Alamannie,Alamannia,https://dantesearch.dantenetwork.it/api.html?lemma=Alamannia,De vulg. I xviii 5,1,De Vulgari Eloquentia,1,Alamannia
0,0,0,0,1,0,0,0,0,0,0,0,"de residuis in extremis Ytalie civitatibus neminem dubitare pendamus - et si quis dubitat, illum nulla nostra solutione dignamur -, parum restat in nostra discussione dicendum. Quare, cribellum cupientes deponere, ut residentiam cito visamus, dicimus Tridentum atque Taurinum nec non <i>Alexandriam</i> civitates metis Ytalie in tantum sedere propinquas quod puras nequeunt habere loquelas; ita quod si etiam quod turpissimum habent vulgare, haberent pulcerrimum, propter aliorum commixtionem esse vere latium negaremus. Quare, si latium illustre venamur, quod venamur in illis inveniri non potest.",Alexandriam,Alexandria,https://dantesearch.dantenetwork.it/api.html?lemma=Alexandria,De vulg. I xv 7,1,De Vulgari Eloquentia,1,Alexandria
0,0,0,0,0,0,1,0,0,0,0,0,"Nec tantum ut assurgatis exhortor, sed ut illius obstupescatis aspectum. Qui bibitis fluenta eius maria navigatis; qui calcatis arenas littorum et <i>Alpium</i> summitates, que sue sunt; qui publicis quibuscunque gaudetis, et res privatas vinculo sue legis, non aliter, possidetis; nolite, velut ignari, decipere tanquam sompniantes, in cordibus et dicentes: «Dominum non habemus».",Alpium,Alpes,https://dantesearch.dantenetwork.it/api.html?lemma=Alpes,Ep. V 20,1,Epistole,1,Alpes
0,0,0,0,0,0,3,0,0,0,0,0,"Precaveant sacratissimi regis alta consilia, ne celeste iudicium Samuelis illa verba reasperet: «Nonne cum parvulus esses in oculis tuis, caput in tribubus Israel factus es, te Dominus in regem super Israel, et misit te Deus in via et ait: Vade et interfice peccatores <i>Amalech? </i>». Nam et tu in regem sacratus es ut Amalech percutias et Agag non pareas, atque ulciscaris Illum qui misit te de gente brutali et de festina sua sollempnitate; que quidem et Amalech et Agag sonare dicuntur.",Amalech?,Amalech,https://dantesearch.dantenetwork.it/api.html?lemma=Amalech,Ep. VII 19,3,Epistole,1,Amalech
0,0,0,0,0,0,3,0,0,0,0,0,"Precaveant sacratissimi regis alta consilia, ne celeste iudicium Samuelis illa verba reasperet: «Nonne cum parvulus esses in oculis tuis, caput in tribubus Israel factus es, te Dominus in regem super Israel, et misit te Deus in via et ait: Vade et interfice peccatores Amalech?». Nam et tu in regem sacratus es ut <i>Amalech</i> percutias et Agag non pareas, atque ulciscaris Illum qui misit te de gente brutali et de festina sua sollempnitate; que quidem et Amalech et Agag sonare dicuntur.",Amalech,Amalech,https://dantesearch.dantenetwork.it/api.html?lemma=Amalech,Ep. VII 19,3,Epistole,2,Amalech
0,0,0,0,0,0,3,0,0,0,0,0,"Precaveant sacratissimi regis alta consilia, ne celeste iudicium Samuelis illa verba reasperet: «Nonne cum parvulus esses in oculis tuis, caput in tribubus Israel factus es, te Dominus in regem super Israel, et misit te Deus in via et ait: Vade et interfice peccatores Amalech?». Nam et tu in regem sacratus es ut Amalech percutias et Agag non pareas, atque ulciscaris Illum qui misit te de gente brutali et de festina sua sollempnitate; que quidem et <i>Amalech</i> et Agag sonare dicuntur.",Amalech,Amalech,https://dantesearch.dantenetwork.it/api.html?lemma=Amalech,Ep. VII 19,3,Epistole,3,Amalech
0,0,0,0,1,0,0,0,0,0,0,0,"Ab uno postea ydiomate in vindice confusione recepto diversa vulgaria traxerunt originem, sicut inferius ostendemus. Nam totum quod ab hostiis Danubii sive Meotidis paludibus usque ad fines occidentales <i>Anglie</i> Ytalorum finibus et Oceano limitatur, solum unum obtinuit ydioma, licet postea per Sclavones, Ungaros, Teutonicos, Saxones, Anglicos et alias nationes quamplures fuerit per diversa vulgaria dirivatum, hoc solo fere omnibus in signum eiusdem principii remanente, quod quasi predicti omnes affirmando respondent.",Anglie,Anglia,https://dantesearch.dantenetwork.it/api.html?lemma=Anglia,De vulg. I viii 3,1,De Vulgari Eloquentia,1,Anglia
0,0,0,0,1,0,0,0,0,0,0,0,"Istorum vero proferentes meridionalis Europe tenent partem occidentalem, a Ianuensium finibus incipientes. Qui autem dicunt a predictis finibus orientalem tenent, videlicet usque ad promuntorium illud Ytalie qua sinus Adriatici maris incipit, et Siciliam. Sed loquentes quodam modo septentrionales sunt respectu istorum: nam ab oriente Alamannos habent et ab occidente et septentrione <i>anglico mari</i> vallati sunt et montibus Aragonie terminati; a meridie quoque Provincialibus et Apenini devexione clauduntur.",anglico,Anglicus,https://dantesearch.dantenetwork.it/api.html?lemma=Anglicus,De vulg. I viii 6,1,De Vulgari Eloquentia,1,Anglicum mare
0,0,0,0,3,1,1,0,0,0,0,0,"Istorum vero proferentes meridionalis Europe tenent partem occidentalem, a Ianuensium finibus incipientes. Qui autem dicunt a predictis finibus orientalem tenent, videlicet usque ad promuntorium illud Ytalie qua sinus Adriatici maris incipit, et Siciliam. Sed loquentes quodam modo septentrionales sunt respectu istorum: nam ab oriente Alamannos habent et ab occidente et septentrione anglico mari vallati sunt et montibus Aragonie terminati; a meridie quoque Provincialibus et <i>Apenini</i> devexione clauduntur.",Apenini,Appenninus,https://dantesearch.dantenetwork.it/api.html?lemma=Appenninus,De vulg. I viii 6,5,De Vulgari Eloquentia,1,Appenninus
0,0,0,0,3,1,1,0,0,0,0,0,"Dicimus ergo primo Latium bipartitum esse in dextrum et sinistrum. Si quis autem querat de linea dividente, breviter respondemus esse iugum <i>Apenini</i>, quod, ceu fistule culmen hinc inde ad diversa stillicidia grundat aquas, ad alterna hinc inde litora per ymbricia longa distillat, ut Lucanus in secundo describit: dextrum quoque latus Tyrenum mare grundatorium habet, levum vero in Adriaticum cadit.",Apenini,Appenninus,https://dantesearch.dantenetwork.it/api.html?lemma=Appenninus,De vulg. I x 4,5,De Vulgari Eloquentia,2,Appenninus
0,0,0,0,3,1,1,0,0,0,0,0,"Transeuntes nunc humeros <i>Apenini</i> frondiferos levam Ytaliam contatim venemur ceu solemus, orientaliter ineuntes.",Apenini,Appenninus,https://dantesearch.dantenetwork.it/api.html?lemma=Appenninus,De vulg. I xiv 1,5,De Vulgari Eloquentia,3,Appenninus
0,0,0,0,3,1,1,0,0,0,0,0,quid pater <i>Appenninus</i> hiat? Quid concitat equor,Appenninus,Appenninus,https://dantesearch.dantenetwork.it/api.html?lemma=Appenninus,Eg. I 42,5,Egloge,4,Appenninus
0,0,0,0,3,1,1,0,0,0,0,0,"tu, Cesaris et Augusti successor, <i>Apennini</i> iuga transiliens veneranda signa Tarpeia retulisti, protinus longa substiterunt suspiria diluvia desierunt; et, ceu Titan, preoptatus exoriens, nova spes Latio seculi melioris effulsit.",Apennini,Appenninus,https://dantesearch.dantenetwork.it/api.html?lemma=Appenninus,Ep. VII 5,5,Epistole,5,Appenninus
0,0,0,0,2,0,0,0,0,0,0,0,"Et dextri regiones sunt <i>Apulia</i>, sed non tota, Roma, Ducatus, Tuscia et Ianuensis Marchia; sinistri autem pars Apulie, Marchia Anconitana, Romandiola, Lombardia, Marchia Trivisiana cum Venetiis. Forum Iulii vero et Ystria non nisi leve Ytalie esse possunt; nec insule Tyreni maris, videlicet Sicilia et Sardinia, non nisi dextre Ytalie sunt, vel ad dextram Ytaliam sociande.",Apulia,Apulia,https://dantesearch.dantenetwork.it/api.html?lemma=Apulia,De vulg. I x 5,2,De Vulgari Eloquentia,1,Apulia
0,0,0,0,2,0,0,0,0,0,0,0,"Et dextri regiones sunt Apulia, sed non tota, Roma, Ducatus, Tuscia et Ianuensis Marchia; sinistri autem pars <i>Apulie</i>, Marchia Anconitana, Romandiola, Lombardia, Marchia Trivisiana cum Venetiis. Forum Iulii vero et Ystria non nisi leve Ytalie esse possunt; nec insule Tyreni maris, videlicet Sicilia et Sardinia, non nisi dextre Ytalie sunt, vel ad dextram Ytaliam sociande.",Apulie,Apulia,https://dantesearch.dantenetwork.it/api.html?lemma=Apulia,De vulg. I x 5,2,De Vulgari Eloquentia,2,Apulia
0,0,0,0,1,0,0,0,0,0,0,0,"Istorum vero proferentes meridionalis Europe tenent partem occidentalem, a Ianuensium finibus incipientes. Qui autem dicunt a predictis finibus orientalem tenent, videlicet usque ad promuntorium illud Ytalie qua sinus Adriatici maris incipit, et Siciliam. Sed loquentes quodam modo septentrionales sunt respectu istorum: nam ab oriente Alamannos habent et ab occidente et septentrione anglico mari vallati sunt et montibus <i>Aragonie</i> terminati; a meridie quoque Provincialibus et Apenini devexione clauduntur.",Aragonie,Aragonia,https://dantesearch.dantenetwork.it/api.html?lemma=Aragonia,De vulg. I viii 6,1,De Vulgari Eloquentia,1,Aragonia
0,0,0,0,1,0,0,0,0,7,0,0,"Sed sive advene tunc primitus advenissent, sive ad Europam indigene repedassent, ydioma tripharium homines actulerunt; et afferentium hoc alii meridionalem, alii septentrionalem regionem in Europa sibi sortiti sunt; et tertii, quos nunc Grecos vocamus, partim Europe, partim <i>Asye</i> occuparunt.",Asye,Asia,https://dantesearch.dantenetwork.it/api.html?lemma=Asia,De vulg. I viii 2,8,De Vulgari Eloquentia,1,Asia
0,0,0,0,1,0,0,0,0,7,0,0,Postquam res <i>Asye</i> evertere gentem,Asye,Asia,https://dantesearch.dantenetwork.it/api.html?lemma=Asia,Mon. II iii 10,8,Monarchia,2,Asia
0,0,0,0,1,0,0,0,0,7,0,0,"Quantum vero ad hereditariam, quelibet pars tripartiti orbis tam avis quam coniugibus illum nobilitasse invenitur. Nam <i>Asya</i> propinquioribus avis, ut Assaraco et aliis qui Frigiam regnaverunt, Asye regionem; unde Poeta noster in tertio: Postquam res Asye evertere gentem inmeritam visum superis.",Asya,Asia,https://dantesearch.dantenetwork.it/api.html?lemma=Asia,Mon. II iii 10,8,Monarchia,3,Asia
0,0,0,0,1,0,0,0,0,7,0,0,"Quantum vero ad hereditariam, quelibet pars tripartiti orbis tam avis quam coniugibus illum nobilitasse invenitur. Nam Asya propinquioribus avis, ut Assaraco et aliis qui Frigiam regnaverunt, <i>Asye</i> regionem; unde Poeta noster in tertio: Postquam res Asye evertere gentem inmeritam visum superis.",Asye,Asia,https://dantesearch.dantenetwork.it/api.html?lemma=Asia,Mon. II iii 10,8,Monarchia,4,Asia
0,0,0,0,1,0,0,0,0,7,0,0,"Similiter etiam coniugio nobilitatum fuisse reperio. Prima coniunx Creusa, Priami regis filia, de <i>Asya</i> fuit, ut superius haberi potest per ea que dicta sunt. Et quod fuerit coniunx testimonium perhibet noster Poeta in tertio, ubi Andromache de Ascanio filio Eneam genitorem interrogat sic: Quid puer Ascanius et vescitur aura, quem tibi iam Troya peperit fumante Creusa?",Asya,Asia,https://dantesearch.dantenetwork.it/api.html?lemma=Asia,Mon. II iii 14,8,Monarchia,6,Asia
0,0,0,0,1,0,0,0,0,7,0,0,"Primus in mortalibus, qui ad hoc bravium anelavit, Ninus fuit Assiriorum rex: qui quamvis cum consorte thori Semiramide per nonaginta et plures annos, ut Orosius refert, imperium mundi armis temptaverit et <i>Asyam</i> totam sibi subegerit, non tamen occidentales mundi partes eis unquam subiecte fuerunt.",Asyam,Asia,https://dantesearch.dantenetwork.it/api.html?lemma=Asia,Mon. II viii 3,8,Monarchia,7,Asia
0,0,0,0,1,0,0,0,0,7,0,0,"Secundus Vesoges, rex Egipti, ad hoc bravium spiravit; et quamvis meridiem atque septentrionem in <i>Asya</i> exagitaverit, ut Orosius memorat, nunquam tamen dimidiam partem orbis obtinuit; quin ymo a Scithis inter quasi athlotetas et terminum ab incepto suo temerario est aversus.",Asya,Asia,https://dantesearch.dantenetwork.it/api.html?lemma=Asia,Mon. II viii 5,8,Monarchia,8,Asia
0,0,0,0,1,0,0,0,0,7,0,0,"Post hos vero Xerxes, Darii filius et rex in Persis, cum tanta gentium multitudine mundum invasit, cum tanta potentia, ut transitum maris <i>Asyam</i> ab Europa dirimentis inter Sexton et Abidon ponte superaverit. Cuius operis admirabilis Lucanus in secundo Farsalie memor fuit; canit enim ibi sic: Tales fama canit tumidum super equora Xerxem construxisse vias. Et tandem, miserabiliter ab incepto repulsus, ad bravium pervenire non potuit.",Asyam,Asia,https://dantesearch.dantenetwork.it/api.html?lemma=Asia,Mon. II viii 7,8,Monarchia,9,Asia
0,0,0,0,0,0,1,0,0,4,0,0,"An septi vallo ridiculo cuiquam defensioni confiditis? O male concordes! o mira cupidine obcecati! Quid vallo sepsisse, quid propugnaculis et pinnis urbem armasse iuvabit, cum advolaverit aquila in auro terribilis, que nunc Pirenen, nunc Caucason, nunc <i>Athlanta</i> supervolans, militie celi magis confortata sufflamine, vasta maria quondam transvolando despexit? quid, cum adfore stupescetis, miserrimi hominum, delirantis Hesperie domitorem?",Athlanta,Atlas,https://dantesearch.dantenetwork.it/api.html?lemma=Atlas,Ep. VI 12,5,Epistole,1,Atlas
0,0,0,0,0,0,1,0,0,4,0,0,advehitur Teucros: Electram maximus <i>Athlas</i>,Athlas,Atlas,https://dantesearch.dantenetwork.it/api.html?lemma=Atlas,Mon. II iii 11,5,Monarchia,2,Atlas
0,0,0,0,0,0,1,0,0,4,0,0,"Europa vero avo antiquissimo, scilicet Dardano: Affrica quoque avia vetustissima, Electra scilicet, nata magni nominis regis <i>Athlantis</i>; ut de ambobus testimonium reddit Poeta noster in octavo, ubi Eneas ad Evandrum sic ait: Dardanus yliace primus pater urbis et auctor, Electra, ut Grai perhibent, Athlantide cretus, advehitur Teucros: Electram maximus Athlas edidit, ethereos humero qui sustinet orbes.",Athlantis,Atlas,https://dantesearch.dantenetwork.it/api.html?lemma=Atlas,Mon. II iii 11,5,Monarchia,3,Atlas
0,0,0,0,0,0,1,0,0,4,0,0,"Quod vero <i>Athlas</i> de Affrica fuerit, mons in illa suo nomine dictus est testis, quem esse in Affrica dicit Orosius in sua mundi descriptione sic: «Ultimus autem finis eius est mons Athlas et insule quas Fortunatas vocant»; “eius”, idest Affrice, quia de ipsa loquebatur.",Athlas,Atlas,https://dantesearch.dantenetwork.it/api.html?lemma=Atlas,Mon. II iii 13,5,Monarchia,5,Atlas
0,0,0,0,0,0,1,0,0,4,0,0,"Quod vero Athlas de Affrica fuerit, mons in illa suo nomine dictus est testis, quem esse in Affrica dicit Orosius in sua mundi descriptione sic: «Ultimus autem finis eius est mons <i>Athlas</i> et insule quas Fortunatas vocant»; “eius”, idest Affrice, quia de ipsa loquebatur.",Athlas,Atlas,https://dantesearch.dantenetwork.it/api.html?lemma=Atlas,Mon. II iii 13,5,Monarchia,6,Atlas
0,1,0,0,0,0,0,0,0,1,0,0,"O felicem populum, o <i>Ausoniam</i> te gloriosam, si vel nunquam infirmator ille Imperii tui natus fuisset, vel nunquam sua pia intentio ipsum fefellisset!",Ausoniam,Ausonia,https://dantesearch.dantenetwork.it/api.html?lemma=Ausonia,Mon. II xi 8,2,Monarchia,1,Ausonia
0,1,0,0,0,0,0,0,0,1,0,0,e quel corno d' <i>Ausonia</i> che s' imborga,Ausonia,Ausonia,https://dantesearch.dantenetwork.it/api.html?lemma=Ausonia,Par. VIII 61,2,Commedia - Paradiso,2,Ausonia
0,0,0,0,3,0,0,0,0,0,0,0,"Hac forma locutionis locutus est Adam; hac forma locutionis locuti sunt omnes posteri eius usque ad edificationem turris <i>Babel</i>, que “turris confusionis” interpretatur; hanc formam locutionis hereditati sunt filii Heber, qui ab eo dicti sunt Hebrei.",Babel,Babel,https://dantesearch.dantenetwork.it/api.html?lemma=Babel,De vulg. I vi 5,3,De Vulgari Eloquentia,1,Babel
0,0,0,0,3,0,0,0,0,0,0,0,"Presumpsit ergo in corde suo incurabilis homo, sub persuasione gigantis Nembroth, arte sua non solum superare naturam, sed etiam ipsum naturantem, qui Deus est, et cepit edificare turrim in Sennaar, que postea dicta est <i>Babel</i>, hoc est “confusio”, per quam celum sperabat ascendere, intendens inscius non equare, sed suum superare Factorem.",Babel,Babel,https://dantesearch.dantenetwork.it/api.html?lemma=Babel,De vulg. I vii 4,3,De Vulgari Eloquentia,2,Babel
0,0,0,0,3,0,0,0,0,0,0,0,"Est igitur super quod gradimur ydioma tractando tripharium, ut superius dictum est: nam alii alii alii vero dicunt Et quod unum fuerit a principio confusionis (quod prius probandum est) apparet, quia convenimus in vocabulis multis, velut eloquentes doctores ostendunt: que quidem convenientia ipsi confusioni repugnat, que ruit celitus in edificatione <i>Babel</i>.",Babel,Babel,https://dantesearch.dantenetwork.it/api.html?lemma=Babel,De vulg. I ix 2,3,De Vulgari Eloquentia,3,Babel
0,0,0,0,0,0,1,0,0,2,0,0,"Tunc hereditas nostra, quam sine intermissione deflemus ablatam, nobis erit in integrum restituta; ac quemadmodum, sacrosancte Ierusalem memores, exules in <i>Babilone</i> gemiscimus, ita tunc cives et respirantes in pace, confusionis miserias in gaudio recolemus.",Babilone,Babylo,https://dantesearch.dantenetwork.it/api.html?lemma=Babylo,Ep. VII 30,3,Epistole,1,Babylo
0,0,0,0,0,0,1,0,0,2,0,0,"Deinde Cirus, rex Persarum, temptavit hoc: qui, <i>Babilone</i> destructa Babilonis ad Persas translato, nec adhuc partes occidentales expertus, sub Tamiride regina Scitharum vitam simul et intentionem deposuit.",Babilone,Babylo,https://dantesearch.dantenetwork.it/api.html?lemma=Babylo,Mon. II viii 6,3,Monarchia,2,Babylo
0,0,0,0,0,0,1,0,0,2,0,0,"Deinde Cirus, rex Persarum, temptavit hoc: qui, Babilone destructa <i>Babilonis</i> ad Persas translato, nec adhuc partes occidentales expertus, sub Tamiride regina Scitharum vitam simul et intentionem deposuit.",Babilonis,Babylo,https://dantesearch.dantenetwork.it/api.html?lemma=Babylo,Mon. II viii 6,3,Monarchia,3,Babylo
